registration_number,name,trading_name,trading_type,address,city,postcode,website,property_count,status,tribunal_total_cases,tribunal_negative_outcomes,tribunal_positive_outcomes,tribunal_neutral_outcomes,tribunal_pfeo_issued,tribunal_pfeo_proposed,tribunal_pfeo_resolved,tribunal_pfeo_unresolved,tribunal_pfeo_pending,tribunal_complied,tribunal_failure_to_comply,tribunal_dismissed,tribunal_rejected,tribunal_withdrawn,tribunal_other_outcomes,tribunal_upper_tribunal_appeals,tribunal_section_1_violations,tribunal_section_2_violations,tribunal_section_3_violations,tribunal_section_4_violations,tribunal_section_5_violations,tribunal_section_6_violations,tribunal_section_7_violations,tribunal_pf_duty_violations,tribunal_earliest_case,tribunal_latest_case,tribunal_case_refs
PF000732,Land Trust Estates Scotland Limited,Land Trust Estates Scotland Limited,Company,"c/o T C Young, 7 West George St, Glasgow, G2 1BA",c/o T C Young,G2 1BA,,0,Registration expired on 28/11/2023,0,0,0,0,0,0,,,,0,0,0,0,0,0,0,0,0,0,0,0,0,0,0,,,
PF000705,Land Trust Residential Services Limited,Land Trust Residential Services Limited,Company,"7 Birchwood One, Dewhurst Road, Birchwood, Warrington, WA3 7GB",Dewhurst Road,WA3 7GB,,0,Registration expired on 23/12/2019,0,0,0,0,0,0,,,,0,0,0,0,0,0,0,0,0,0,0,0,0,0,0,,,
PF000666,Langstane Housing Association Limited,Langstane Housing Association Limited,Registered Social Landlord,"680 King Street, Aberdeen, AB24 1SL",Aberdeen,AB24 1SL,http://www.langstane-ha.co.uk/,95,Registered,0,0,0,0,0,0,,,,0,0,0,0,0,0,0,0,0,0,0,0,0,0,0,,,
PF000815,LAR Housing Trust,LAR Housing Trust,Other Legal Status,"Buchan House, Enterprise Way, Dunfermline, KY11 8PL",Buchan House,KY11 8PL,https://www.larhousingtrust.co.uk,40,Registered,1,1,0,0,0,0,0,0,0,0,0,0,0,0,1,0,0,0,0,0,0,0,0,1,2018-08-27,2018-08-27,FTS/HPC/PF/18/1186
PF000814,LAR Operations C.I.C.,LAR Property Management,Company,"F3 Buchan House, Enterprise Way, Dunfermline, KY11 8PL",Enterprise Way,KY11 8PL,https://www.larhousingtrust.co.uk,168,Registered,2,2,0,0,0,0,0,0,0,0,0,0,0,0,2,1,0,1,0,0,0,1,1,0,2021-07-29,2024-07-24,FTS/HPC/PF/22/3577 | FTS/HPC/PF/22/3578 | FTS/HPC/LM/22/3579 | FTS/HPC/PF/21/1062
PF000279,Larkfield Housing Association Limited,Larkfield Housing,Registered Social Landlord,"14 Lothian Road, Greenock, PA16 0PG",Greenock,PA16 0PG,https://www.larkfieldha.org.uk/,960,Registered,0,0,0,0,0,0,,,,0,0,0,0,0,0,0,0,0,0,0,0,0,0,0,,,
PF000752,Lettingsupermarket.com Limited,Lettingsupermarket.com Limited,Company,"Unit 5, Bicton Business Park, Shrewsbury, SY3 8DY",Bicton Business Park,SY3 8DY,,0,Registration expired on 18/01/2021,0,0,0,0,0,0,,,,0,0,0,0,0,0,0,0,0,0,0,0,0,0,0,,,
PF000096,Levern Property Services Ltd,Levern Property Services Ltd,Registered Social Landlord,"60-70 Main Street, Barrhead, G78 1SB",Barrhead,G78 1SB,,0,Registration expired on 07/03/2025,1,0,1,0,0,0,1,0,0,1,0,0,0,0,0,0,1,1,1,0,0,1,0,1,2020-03-02,2020-03-02,FTS/HPC/PF/19/2980
PF000203,Life Property Management Ltd,Life Property Management Ltd,Company,"Regent Court, 70 West Regent Street, Glasgow, G2 2QZ",Regent Court,G2 2QZ,,0,Registration expired on 07/09/2022,17,12,4,1,1,1,3,2,2,3,2,0,1,0,9,3,5,10,7,4,3,9,4,10,2013-07-30,2021-06-16,FTS/HPC/PF/16/1009 | FTS/HPC/PF/17/0322 | FTS/HPC/PF/18/0199 | FTS/HPC/PF/20/1955 | FTS/HPC/PF/20/1954 | FTS/HPC/PF/20/1956 | FTS/HPC/PF/20/1957 | FTS/HPC/PF/20/1958 | FTS/HPC/PF/20/1959 | FTS/HPC/PF/20/1960 | FTS/HPC/PF/20/1961 | FTS/HPC/PF/20/1962 | FTS/HPC/PF/20/1969 | FTS/HPC/PF/20/1970 | FTS/HPC/PF/20/1971 | FTS/HPC/PF/20/1973 | FTS/HPC/PF/20/1974 | FTS/HPC/PF/20/1975 | FTS/HPC/PF/20/1977 | FTS/HPC/PF/20/1979 | FTS/HPC/PF/20/1981 | FTS/HPC/PF/20/1964 | FTS/HPC/GP/20/0389 | FTS/HPC/PF/19/2658 | FTS/HPC/PF/19/0802 | FTS/HPC/PF/18/1249 | PF000203 | FTS/HPC/LM/17/0245 | FTS/HPC/LM/17/0245 | HOHP/PF/16/0087 | HOHP/PF/16/0023 | HOHP/PF/15/0087 | HOHP/PF/15/0051 | HOHP/PF/15/0021 | HOHP/PF/13/0060 | FTS/HPC/PF/17/0412
PF000355,Link Housing Association Limited,Link Housing Association Limited,Company,"Link House, 2C New Mart Road, Edinburgh, EH14 1RL",Link House,EH14 1RL,,0,Registration expired on 07/03/2025,10,7,3,0,3,0,3,5,1,3,3,0,0,0,1,0,2,4,2,2,3,6,5,7,2015-02-12,2019-11-21,FTS/HPC/PF/19/2160 | FTS/HPC/PF/19/2160 | FTS/HPC/LM/18/1725 | FTS/HPC/PF/18/1922 | FTS/HPC/PF/17/0304 | FTS/HPC/PF/17/0253 | FTS/HPC/PF/17/0129 | HOHP/PF/16/0014 | HOHP/PF/16/0014 | HOHP/PF/14/0026
PF000202,Linstone Housing Association Limited,Linstone Housing Association Limited,Registered Social Landlord,"17 Bridge Street, Linwood, PA3 3DB",Linwood,PA3 3DB,https://www.linstone.co.uk,4885,Registered,6,4,2,0,2,1,2,0,3,2,0,0,0,0,1,0,3,4,2,0,0,2,0,4,2017-01-20,2017-02-15,HOHP/PF/16/0108 | HOHP/PF/16/0108 | HOHP/PF/16/0108 | HOHP-PF-15-0143 | HOHP/PF/16/0107 | HOHP/PF/16/0107
PF000162,Linthouse Housing Association Limited,Linthouse Housing Association Limited,Registered Social Landlord,"1 Cressy Street, Glasgow, G51 4RB",Glasgow,G51 4RB,https://www.linthouseha.com,1070,Registered,0,0,0,0,0,0,,,,0,0,0,0,0,0,0,0,0,0,0,0,0,0,0,,,
PF000620,Lisney (NI) Ltd,Lisney (NI) Ltd,Company,"1st Floor Montgomery House, 29-33 Montgomery Street, Belfast, BT1 4NX",Belfast,BT1 4NX,,0,Registration expired on 23/11/2021,0,0,0,0,0,0,,,,0,0,0,0,0,0,0,0,0,0,0,0,0,0,0,,,
PF000737,LIV Group Limited,LIV Group Limited,Company,"Whitehall Waterfront, 2 Riverside Way, Leeds, LS1 4EH",Whitehall Waterfront,LS1 4EH,,0,Registration expired on 23/09/2020,0,0,0,0,0,0,,,,0,0,0,0,0,0,0,0,0,0,0,0,0,0,0,,,
PF000122,Lloyd Younger Ltd,Lloyd Younger Ltd,Company,"Midland Farm, Unit 1, FENWICK, KA3 6BY",Midland Farm,KA3 6BY,,0,Registration expired on 11/11/2025,2,1,1,0,0,1,1,0,1,1,0,0,0,0,0,0,1,1,0,0,0,1,1,1,2021-12-02,2022-07-07,FTS/HPC/PF/21/0404 | FTS/HPC/PF/21/0404
PF000615,Loch Tay Highland Lodge Park Ltd,Loch Tay Highland Lodge Park Ltd,Company,"Milton Morenish Estate, Killin, FK21 8TY",Milton Morenish Estate,FK21 8TY,https://www.lochtay-vacations.co.uk,30,Registered,1,0,1,0,0,0,1,0,0,1,0,0,0,0,0,0,1,1,1,1,1,1,1,1,2019-12-04,2019-12-04,FTS/HPC/LM/19/2134
PF000340,Lochaber Housing Association Ltd,Lochaber Housing Association Ltd,Registered Social Landlord,"101 High Street, Fort William, PH33 6DG",Fort William,PH33 6DG,https://www.lochaberhousing.org.uk,568,Registered,0,0,0,0,0,0,,,,0,0,0,0,0,0,0,0,0,0,0,0,0,0,0,,,
PF000363,Lochaber Housing Association Property Services CIC,Lochaber Housing Association Property Services CIC,Company,"101, High Street, Fort William, PH33 6DG",High Street,PH33 6DG,https://www.lochaberhousing.org.uk,40,Registered,0,0,0,0,0,0,,,,0,0,0,0,0,0,0,0,0,0,0,0,0,0,0,,,
PF000139,Lochalsh & Skye Housing Association,Buidheann Tigheadas Loch Aillse agus an Eilein Sgi,Registered Social Landlord,"Morrison House, Bayfield, Portree, IV51 9EW",Morrison House,IV51 9EW,https://www.LSHA.co.uk,126,Registered,0,0,0,0,0,0,,,,0,0,0,0,0,0,0,0,0,0,0,0,0,0,0,,,
PF000426,Lochaweside Management Company Ltd,Lochaweside Management Company Ltd,Company,"Cobbs Wood Cottage, Old Wimpole Road, Arrington, Royston, SG8 0BP",Cobbs Wood Cottage,SG8 0BP,,0,Registration expired on 17/11/2023,0,0,0,0,0,0,,,,0,0,0,0,0,0,0,0,0,0,0,0,0,0,0,,,
PF000221,Lochfield Park Housing Association Limited,Lochfield Park Housing Association Limited,Registered Social Landlord,"37 Drumlanrig Avenue, Glasgow, G34 0JF",Glasgow,G34 0JF,https://www.lochfield.co.uk,6,Registered,0,0,0,0,0,0,,,,0,0,0,0,0,0,0,0,0,0,0,0,0,0,0,,,
PF000399,Lomond Estate Agents Ltd,Lomond Estate Agents Ltd,Company,"26 Parkhouse Street, Ayr, KA7 2HH",Ayr,KA7 2HH,,0,Registration expired on 23/08/2019,0,0,0,0,0,0,,,,0,0,0,0,0,0,0,0,0,0,0,0,0,0,0,,,
PF000359,Lomond Property Factors Ltd,Lomond Property Factors Ltd,Company,"The Gowk, Gartocharn, Alexandria, G83 8ND",The Gowk,G83 8ND,https://lomondpropertyfactors.co.uk/,184,Registered,5,3,2,0,0,0,2,1,0,2,1,0,0,0,2,0,0,1,0,0,0,1,1,2,2019-08-08,2024-02-05,FTS/HPC/PF/23/2076 | FTS/HPC/PF/21/2368 | FTS/HPC/PF/21/2380 | FTS/HPC/PF/21/2438 | FTS/HPC/PF/21/2439 | FTS/HPC/PF/21/2513 | FTS/HPC/PF/21/2627 | FTS/HPC/PF/20/0529 | FTS/HPC/PF/19/0719 | FTS/HPC/PF/19/1666
PF000938,Loreburn Housing Association Limited,Loreburn Housing Association Limited,Registered Social Landlord,"7 Gifhorn House, Shakespeare Street, Dumfries, DG1 2JB",Shakespeare Street,DG1 2JB,https://www.loreburn.org.uk,640,Registered,0,0,0,0,0,0,,,,0,0,0,0,0,0,0,0,0,0,0,0,0,0,0,,,
PF000402,Loretto Housing Association Ltd,Loretto Housing Association Ltd,Registered Social Landlord,"Wheatley House, 25 Cochrane Street, Fofar, G1 1HL",Wheatley House,G1 1HL,,852,Registered,0,0,0,0,0,0,,,,0,0,0,0,0,0,0,0,0,0,0,0,0,0,0,,,
PF000842,Lorimer Property Group Ltd,Lorimer Property Group Ltd,Company,"Redwood Crescent, East Kilbride, G74 5PA",Redwood Crescent,G74 5PA,https://Lorimerproperty.com,1040,Registered,4,1,3,0,0,0,2,1,0,2,1,0,1,0,0,0,2,3,3,2,1,3,3,3,2023-01-30,2024-11-12,FTS/HPC/PF/23/2448 | FTS/HPC/PF/23/3555 | FTS/HPC/PF/23/1956 | FTS/HPC/PF/22/2897
PF001038,Louise Todd Property Management Ltd,Louise Todd Property Management Ltd,Company,"1st Floor, 87 Commercial Street, Dundee, DD1 2AB",Dundee,DD1 2AB,https://www.lt-pm.co.uk,0,Registered,0,0,0,0,0,0,,,,0,0,0,0,0,0,0,0,0,0,0,0,0,0,0,,,
PF000785,Lowther Homes Limited,Lowther Homes Limited,Company,"Wheatley House, 25 Cochrane Street, Glasgow, G1 1HL",Wheatley House,G1 1HL,https://www.lowtherhomes.com,1216,Registered,36,20,16,0,1,6,6,5,6,6,4,1,9,0,9,0,7,17,2,0,1,19,13,20,2021-05-16,2025-03-10,"FTS/HPC/LM/24/1787 | FTS/HPC/PF/22/4237 | FTS/HPC/LM/23/0079 + FTS/HPC/LM/23/0081 | FTS/HPC/PF/23/3611 | FTS/HPC/PF/24/2591 | FTS/HPC/PF/23/2738 | FTS/HPC/PF/21/1864 | FTS/HPC/PF/24/1518 | FTS/HPC/PF/23/0568 | FTS/HPC/PF/23/0568 | FTS/HPC/PF/23/0234+0236 | FTS/HPC/PF/23/0571+0575 | FTS/HPC/PF/23/2244 | FTS/HPC/PF/23/0234 + 0236 | FTS/HPC/PF/23/2724 | FTS/HPC/PF/23/1907 | FTS/HPC/PF/23/3128 | FTS/HPC/PF/22/3879 | FTS/HPC/PF/23/0499 | FTS/HPC/PF/23/0571, 0574 + 0575 | FTS/HPC/PF/22/2988 | FTS/HPC/PF/22/2851 | FTS/HPC/PF/22/0644 | FTS/HPC/PF/21/3071 & FTS/HPC/PF/21/3232 | FTS/HPC/PF/22/0644 | FTS/HPC/LA/21/3143 | FTS/HPC/PF/21/1771 | FTS/HPC/PF/21/1771 | FTS/HPC/PF/21/1057 | FTS/HPC/PF/21/0889 | FTS/HPC/PF/21/1073 | FTS/HPC/LM/21/0858 | FTS/HPC/PF/21/0873 | FTS/HPC/PF/22/0431 | FTS/HPC/PF/21/0109 | FTS/HPC/PF/22/0043"
PF000781,LYALL BUILDING SOLUTIONS LTD,LYALL BUILDING SOLUTIONS LTD,Company,"51 ALLANVALE ROAD, BRIDGE OF ALLAN, FK9 4PA",BRIDGE OF ALLAN,FK9 4PA,,0,Registration expired on 17/08/2021,1,1,0,0,0,0,0,1,0,0,1,0,0,0,0,0,0,0,0,0,0,0,0,0,2024-03-06,2024-03-06,FTS/HPC/PF/22/3455 | FTS/HPC/PF/22/3750 | FTS/HPC/PF/22/3934 | FTS/HPC/PF/22/3935
PF000098,Macfie & Co Management Services Ltd,Macfie & Co Management Services Ltd,Company,"5 Cathkinview Road, Glasgow, G42 9EA",Glasgow,G42 9EA,https://www.macfie.com,4481,Registered,9,5,4,0,1,0,3,3,1,3,3,0,1,0,1,0,2,4,2,0,1,4,2,6,2017-04-25,2025-01-16,FTS/HPC/PF/23/0918 | FTS/HPC/PF/23/1627 | FTS/HPC/PF/21/2337 | FTS/HPC/PF/20/0699 | FTS/HPC/PF/18/1743 | FTS/HPC/PF/18/1472 | HOHP/PF/16/0179 | FTS/HPC/PF/17/0156 | FTS/HPC/PF/17/0183 | FTS/HPC/PF/17/0018
PF000547,MAJR Properties Limited,MAJR Properties Limited,Company,"Unit 6A, Angus Works, Fairbairn Street, Dundee, DD3 7JZ",Fairbairn Street,DD3 7JZ,,0,Registration expired on 04/06/2018,0,0,0,0,0,0,,,,0,0,0,0,0,0,0,0,0,0,0,0,0,0,0,,,
PF000693,Managing Estates Limited,Managing Estates Limited,Company,"Unit 2a, Brymau Three River Lane, Chester, CH4 8RQ",Brymau Three River Lane,CH4 8RQ,https://www.estatespm.co.uk,1573,Registered,0,0,0,0,0,0,,,,0,0,0,0,0,0,0,0,0,0,0,0,0,0,0,,,
PF000997,Manor Estates Associates Ltd,Manor Estates Associates Ltd,Company,"Suite 4, 5 New Mart Place, Edinburgh, EH14 1RW",Edinburgh,EH14 1RW,https://manorestates.org.uk,20,Registered,0,0,0,0,0,0,,,,0,0,0,0,0,0,0,0,0,0,0,0,0,0,0,,,
PF000157,Manor Estates Housing Association Ltd,Manor Estates Housing Association Ltd,Registered Social Landlord,"Suite 4, 5 New Mart Place, Edinburgh, EH14 1RW",Edinburgh,EH14 1RW,https://www.manorestates.org.uk,1505,Registered,2,2,0,0,1,0,0,2,0,0,1,0,0,0,0,0,1,1,0,0,0,0,1,0,2020-09-03,2020-09-03,FTS/HPC/PF/19/2223 | FTS/HPC/PF/19/2223
PF000821,Mark Kelly,84 Main Street,Sole Trader,"Flat 1, 84 Main Street, Rutherglen, G73 2HZ",Rutherglen,G73 2HZ,,0,Registration expired on 17/05/2022,0,0,0,0,0,0,,,,0,0,0,0,0,0,0,0,0,0,0,0,0,0,0,,,
PF000874,Mark Lindsay,Marks Gardening Service,Sole Trader,"7 Roseburn Place, Coatbridge, ML5 1EN",Coatbridge,ML5 1EN,,0,Registration expired on 17/10/2023,0,0,0,0,0,0,,,,0,0,0,0,0,0,0,0,0,0,0,0,0,0,0,,,
PF000199,Maroco Limited,Wardhaugh Property,Company,"Wardhaugh Property 38/40, East High Street, Fofar, DD8 2EG",East High Street,DD8 2EG,https://www.wardhaughproperty.co.uk,121,Registered,0,0,0,0,0,0,,,,0,0,0,0,0,0,0,0,0,0,0,0,0,0,0,,,
PF000442,MARSHALL MACCALLUM,MARSHALL MACCALLUM,Sole Trader,"1/3 HIGH STREET, DUNBLANE, FK15 0EE",DUNBLANE,FK15 0EE,,0,Registration expired on 08/03/2016,0,0,0,0,0,0,,,,0,0,0,0,0,0,0,0,0,0,0,0,0,0,0,,,
PF000931,Martin Jack Limited,Martin Jack,Company,"Flat 4, Barron House, 88 High Street, Nairn, IV12 4AU",Barron House,IV12 4AU,,6,Registered,0,0,0,0,0,0,,,,0,0,0,0,0,0,0,0,0,0,0,0,0,0,0,,,
PF000396,Maryhill Housing Association Ltd,Maryhill Housing Association Ltd,Registered Social Landlord,"Flat 1, 45 Garrioch Road, Glasgow, G20 8RG",Glasgow,G20 8RG,https://www.maryhill.org.uk,1976,Registered,2,1,1,0,0,0,1,0,0,1,0,0,0,0,1,0,0,0,0,0,0,1,0,1,2014-04-02,2021-11-24,FTS/HPC/PF/21/1868 | HOHP/PF/13/0273
PF000115,Matthew Cohen & Associates Ltd,Matthew Cohen & Associates Ltd,Company,"269 Holburn Street, Aberdeen, AB10 7FL",Aberdeen,AB10 7FL,,0,Registration expired on 01/08/2016,0,0,0,0,0,0,,,,0,0,0,0,0,0,0,0,0,0,0,0,0,0,0,,,
PF001017,MBM Property Management (Scotland) Limited,MBM Property Management,Company,"12 Holmlea Road, Glasgow, G44 4AH",Glasgow,G44 4AH,https://www.mbmhomelets.com,96,Registered,0,0,0,0,0,0,,,,0,0,0,0,0,0,0,0,0,0,0,0,0,0,0,,,
PF001135,McAslan Services Ltd,McAslan Services Ltd,Company,"62 Kinnear Road, Glasgow, G40 3JW",Glasgow,G40 3JW,https://mcaslanproperty.co.uk/,0,Registered,0,0,0,0,0,0,,,,0,0,0,0,0,0,0,0,0,0,0,0,0,0,0,,,
PF000391,McCarthy & Stone Management Services Limited,McCarthy Stone,Company,"1 Ainslie Road, Glasgow, G52 4RU",Glasgow,G52 4RU,https://www.mccarthyandstone.co.uk,963,Registered,3,0,3,0,0,0,2,0,0,2,0,0,1,0,0,0,0,2,0,0,0,0,0,2,2019-07-09,2025-11-28,FTS/HPC/PF/25/3851 | FTS/HPC/PF/19/0987 | FTS/HPC/PF/19/0970
PF000443,MCDONALD PROPERTY MANAGEMENT,MCDONALD PROPERTY MANAGEMENT,Partnership,"30 MITCHELL GROVE, EAST KILBRIDE, G74 1QZ",East Kilbride,G74 1QZ,,0,Registration expired on 29/03/2016,0,0,0,0,0,0,,,,0,0,0,0,0,0,0,0,0,0,0,0,0,0,0,,,
PF000635,McGregor Letting,McGregor Letting,Sole Trader,"16 Windmill Road, LEVEL 3/3, HAMILTON, ML3 6LU",Hamilton,ML3 6LU,,0,Registration expired on 08/01/2019,0,0,0,0,0,0,,,,0,0,0,0,0,0,0,0,0,0,0,0,0,0,0,,,
PF001136,McIntyre Property Consultants Ltd,McIntyre Property Consultants Ltd,Company,"Standard Buildings, 10 Hope Street, Glasgow, G2 6PH",Standard Buildings,G2 6PH,https://mcintyreproperty.com,0,Registered,0,0,0,0,0,0,,,,0,0,0,0,0,0,0,0,0,0,0,0,0,0,0,,,
PF000469,McKenzie Accountants Ltd,McKenzie Accountants Ltd,Company,"12A Chester Street, Edinburgh, EH3 7RA",Edinburgh,EH3 7RA,,154,Registered,0,0,0,0,0,0,,,,0,0,0,0,0,0,0,0,0,0,0,0,0,0,0,,,
PF001004,McNeill Maguire & McCreath Surveyors Limited,Allied Surveyors Scotland,Company,"2 West Maitland Street, Edinburgh, EH12 5DS",Edinburgh,EH12 5DS,https://www.alliedsurveyorsscotland.com/,42,Registered,0,0,0,0,0,0,,,,0,0,0,0,0,0,0,0,0,0,0,0,0,0,0,,,
PF000675,MCS FACTORS LTD,MCS FACTORS LTD,Company,"c/o Hutchison & Co, Unit 5b Whitecrook Centre, 78 Whitecrook Street, Clydebank, G81 1QF",c/o Hutchison & Co,G81 1QF,,0,Registration expired on 25/10/2018,0,0,0,0,0,0,,,,0,0,0,0,0,0,0,0,0,0,0,0,0,0,0,,,
PF001163,MDLC Property Services Ltd,MDLC Property Services Ltd,Company,"97 Finella Place, Dundee, DD4 9LS",Dundee,DD4 9LS,https://www.mdlcpropertyservices.com,0,Registered,0,0,0,0,0,0,,,,0,0,0,0,0,0,0,0,0,0,0,0,0,0,0,,,
PF000107,ME Property Group Ltd,ME Property Group Ltd,Company,"6 Lonmay Place, Queenslie, Glasgow, G33 4ER",Queenslie,G33 4ER,,0,Registration expired on 14/01/2016,0,0,0,0,0,0,,,,0,0,0,0,0,0,0,0,0,0,0,0,0,0,0,,,
PF000224,Meadfleet Limited,Meadfleet Limited,Company,"Suite 1, 3rd Floor, Southgate House, St Georges Way, Stevenage, SG1 1HG",Southgate House,SG1 1HG,,0,Registration expired on 14/01/2016,2,0,2,0,0,0,2,0,0,2,0,0,0,0,0,0,0,0,0,0,0,0,0,0,2014-03-03,2015-02-03,HOHP/LM/14/0074 | HOHP/LM/13/0274
PF000786,Melfort Pier Homeowners Association,Melfort Pier Homeowners Association,Other Legal Status,"Melfort Pier, Kilmelford, Argyll, Oban, PA34 4XD",Melfort Pier,PA34 4XD,,0,Registration expired on 06/11/2024,0,0,0,0,0,0,,,,0,0,0,0,0,0,0,0,0,0,0,0,0,0,0,,,
PF000388,Melville Housing Association Limited,Melville Housing Association Limited,Registered Social Landlord,"The Corn Exchange, 200 High Street, Dalkeith, EH22 1AZ",The Corn Exchange,EH22 1AZ,https://www.melville.org.uk,576,Registered,1,1,0,0,0,0,0,0,0,0,0,0,0,0,1,0,0,0,0,0,0,1,0,0,2017-11-02,2017-11-02,FTS/HPC/PF/17/0282
PF000731,Melville Property Limited,Melville Property Limited,Company,"Unit 7, West Gorgie Park, Hutchison Road, Edinburgh, EH14 1UT",West Gorgie Park,EH14 1UT,,0,Registration expired on 30/08/2023,8,7,1,0,7,0,0,0,7,0,0,0,1,0,0,0,0,1,7,7,0,0,7,7,2021-12-22,2022-06-29,FTS/HPC/PF/21/2377 | FTS/HPC/PF/21/2385 | FTS/HPC/PF/21/2388 | FTS/HPC/PF/21/2397 | FTS/HPC/PF/21/2401 | FTS/HPC/PF/21/2503 | FTS/HPC/PF/21/2615 | FTS/HPC/PF/21/2425
PF001066,Metropole Glasgow Limited,Metropole Glasgow Limited,Company,"First Floor, 4 Earls Court, Earls Gate Business Park, Grangemouth, FK3 8ZE",First Floor,FK3 8ZE,,94,Registered,0,0,0,0,0,0,,,,0,0,0,0,0,0,0,0,0,0,0,0,0,0,0,,,
PF000959,Mezzino Limited,Mezzino Limited,Company,"The Coach House, Hexgreave Hall, Farnsfield, NG22 8LS",The Coach House,NG22 8LS,https://www.mezziono.co.uk,10,Registered,0,0,0,0,0,0,,,,0,0,0,0,0,0,0,0,0,0,0,0,0,0,0,,,
PF000896,MGLT Ltd,Thomson Property Factors,Company,"59 Strathblane Road, Milngavie, Glasgow, G62 8HA",Milngavie,G62 8HA,,0,Registration expired on 12/12/2023,0,0,0,0,0,0,,,,0,0,0,0,0,0,0,0,0,0,0,0,0,0,0,,,
PF000339,MHA Auchlochan,MHA Auchlochan,Company,"Azets, Titanium 1,, King's Inch Place,, Glasgow, PA4 8WF",Azets,PA4 8WF,,0,Registration expired on 10/07/2025,0,0,0,0,0,0,,,,0,0,0,0,0,0,0,0,0,0,0,0,0,0,0,,,
PF000314,Miller Property Management Ltd,Miller Property Management Ltd,Company,"Suite 2.2, Waverley House, Hamilton Business Park, Caird Park, Hamilton, ML3 0QA",Waverley House,ML3 0QA,,0,Registration expired on 11/01/2022,12,9,3,0,4,1,2,6,2,2,3,0,1,0,1,1,2,9,5,2,4,6,6,6,2017-06-06,2025-01-21,"FTS/HPC/PF/19/2307 | FTS/HPC/PF/23/1461 | FTS/HPC/PF/21/0456 | FTS/HPC/PF/23/0588 | FTS/HPC/PF/23/0588 | FTS/HPC/GP/21/0093 | FTS/HPC/PF/21/0425, FTS/HPC/PF/21/0379, FTS/HPC/PF/21/0403, FTS/HPC/PF/21/0398, FTS/HPC/PF/21/0424 & FTS/HPC/PF/21/0510 | FTS/HPC/PF/21/0458 | FTS/HPC/PF/21/0459 | FTS/HPC/PF/20/0209 | FTS/HPC/PF/20/0209 | FTS/HPC/PF/17/0127 | FTS/HPC/PF/20/2460"
PF000955,Miller Property Management Ltd,Miller Property Management Ltd,Company,"Suite 2.2 Waverley House, Caird Park, Hamilton Business Park, Hamilton, ML3 0QA",Caird Park,ML3 0QA,,1550,Registered,3,3,0,0,1,1,0,2,1,0,1,0,0,0,0,0,0,0,0,0,0,0,0,0,2015-08-26,2023-10-05,FTS/HPC/PF/23/1527 | FTS/HPC/PF/21/1362 | HOHP/PF/14/0148
PF000428,Miller Stewart,Miller Stewart,Company,"9 Donaldson Crescent, Southbank Business Park, Kirkintilloch, Glasgow, G66 1XF",Southbank Business Park,G66 1XF,,0,Registration expired on 08/03/2016,0,0,0,0,0,0,,,,0,0,0,0,0,0,0,0,0,0,0,0,0,0,0,,,
PF000368,Milnbank Property Services Ltd,Milnbank Property Services Ltd,Registered Social Landlord,"53 Ballindalloch Drive, Greenock, G31 3DQ",Greenock,G31 3DQ,https://www.milnbank.org.uk,2979,Registered,0,0,0,0,0,0,,,,0,0,0,0,0,0,0,0,0,0,0,0,0,0,0,,,
PF000876,MiPropit.com Ltd,PropPal,Company,"Trinity House, 31 Lynedoch Street, Glasgow, G3 6EF",Trinity House,G3 6EF,,0,Registration expired on 17/11/2023,0,0,0,0,0,0,,,,0,0,0,0,0,0,0,0,0,0,0,0,0,0,0,,,
PF000497,MITIE LANDSCAPES LIMITED,MITIE LANDSCAPES LIMITED,Company,"1 Harlequin Office Park, Fieldfare, Emersons Green, Bristol, BS16 7FN",Fieldfare,BS16 7FN,,0,Registration expired on 10/02/2020,0,0,0,0,0,0,,,,0,0,0,0,0,0,0,0,0,0,0,0,0,0,0,,,
PF000741,MLS Capital Group Limited,MLS Capital Group Limited,Company,"Honeyfield, Kirkton of Rayne, Meikle Wartle, Inverurie, AB51 5AD",Honeyfield,AB51 5AD,,0,Registration expired on 22/09/2020,0,0,0,0,0,0,,,,0,0,0,0,0,0,0,0,0,0,0,0,0,0,0,,,
PF000125,Molendinar Park Housing Association,Molendinar Park Housing Association,Registered Social Landlord,"3 Graham Square, Glasgow, G31 1AD",Glasgow,G31 1AD,https://www.molendinar.org.uk,429,Registered,0,0,0,0,0,0,,,,0,0,0,0,0,0,0,0,0,0,0,0,0,0,0,,,
PF001027,Moorfoot Property Management Ltd,Moorfoot Property Management Ltd,Company,"86-90 Paul Street, London, EC2A 4NE",London,EC2A 4NE,,0,Registered,0,0,0,0,0,0,,,,0,0,0,0,0,0,0,0,0,0,0,0,0,0,0,,,
PF001132,Moravia Apartments Factor Services (Elgin) Ltd,Moravia Apartments Factor Services (Elgin) Ltd,Company,"135 Muirfield Road, Elgin, IV30 6DD",Elgin,IV30 6DD,,0,Registered,0,0,0,0,0,0,,,,0,0,0,0,0,0,0,0,0,0,0,0,0,0,0,,,
PF000249,Morison Walker Property Management Ltd,Morison Walker Property Management Ltd,Company,"23 Patrick Street, GREENOCK, PA16 8NB",Greenock,PA16 8NB,,0,Registration expired on 11/07/2025,8,5,3,0,1,0,3,2,0,3,1,0,0,0,3,0,6,5,1,2,1,4,3,6,2014-10-06,2024-11-18,FTS/HPC/PF/23/3240 | FTS/HPC/PF/22/0625 | FTS/HPC/PF/22/1127 | FTS/HPC/PF/19/2049 | FTS/HPC/PF/18/0509 | FTS/HPC/PF/18/0035 | HOHP/PF/16/0161 | HOHP/PF/6/0050 | HOHP/PF/13/0296
PF001154,MPM Property Services Limited,MPM Property Services Limited,Company,"29 Tennant Avenue, Glasgow, G74 5NA",Glasgow,G74 5NA,,0,Registered,0,0,0,0,0,0,,,,0,0,0,0,0,0,0,0,0,0,0,0,0,0,0,,,
PF000253,Murdoch MacKenzie Construction Ltd,Murdoch MacKenzie Construction Ltd,Company,"Coursington Road, Motherwell, ML1 1NR",Coursington Road,ML1 1NR,,0,Registration expired on 14/01/2022,0,0,0,0,0,0,,,,0,0,0,0,0,0,0,0,0,0,0,0,0,0,0,,,
PF000227,Murphy Scoular,Murphy Scoular,Partnership,"22/24 John Finnie Street, Kilmarnock, KA1 1DD",Kilmarnock,KA1 1DD,,0,Registration expired on 26/04/2022,2,1,1,0,0,0,1,0,0,1,0,0,0,0,1,0,1,1,0,1,0,1,1,1,2013-06-19,2017-10-06,FTS/HPC/PF/17/0216 | HOHP/PF/13/0062
PF000169,Murray Laing trading as Laing & Co,Murray Laing trading as Laing & Co,Sole Trader,"10 Paties Road, Edinburgh, EH14 1EF",Edinburgh,EH14 1EF,,0,Registration expired on 12/02/2019,0,0,0,0,0,0,,,,0,0,0,0,0,0,0,0,0,0,0,0,0,0,0,,,
PF000979,MXM Property Solutions Limited,MXM Property Solutions Limited,Company,"Dalsetter Business Centre, Unit 13, 42 Dalsetter Avenue, Glasgow, G15 8TE",Dalsetter Business Centre,G15 8TE,https://www.mxmps.com,200,Registered,1,1,0,0,0,0,0,0,0,0,0,0,0,0,1,0,1,1,0,0,1,0,1,1,,,FTS/HPC/PF/22/3792
PF000290,MXM Property Solutions Ltd,MXM Property Solutions Ltd,Company,"Dalsetter Business Centre, Unit 13, 42 Dalsetter Avenue, Glasgow, G15 8TE",Dalsetter Business Centre,G15 8TE,,0,Registration expired on 22/07/2022,10,8,2,0,0,0,2,5,0,2,5,0,0,0,3,1,1,6,3,3,0,2,2,2,2016-10-19,2021-04-09,"FTS/HPC/PF/20/1377 | FTS/HPC/PF/20/0046 | FTS/HPC/PF/19/3547 | FTS/HPC/PF/17/0229 | FTS/HPC/PF/17/0196, 0198, 0201, 0213, 0002 | FTS/HPC/PF/17/0318 | FTS/HPC/PF/17/0158 0159 0160 0202 | FTS/HPC/PF/17/0236 | HOHP/PF/16/0133 | HOHP/PF/15/0141"
PF000177,Myreside Management Limited,Myreside Management Limited,Company,"3 Dalkeith Road Mews, Edinburgh, EH16 5GA",Edinburgh,EH16 5GA,https://www.myreside-management.co.uk,3709,Registered,9,3,6,0,1,0,5,1,0,5,0,0,1,0,2,0,3,2,2,0,1,1,2,4,2013-12-13,2024-09-19,FTS/HPC/PF/23/4547 | FTS/HPC/PF/24/2551 | FTS/HPC/PF/24/1914 | FTS/HPC/PF/23/2788 | FTS/HPC/PF/23/3501 | FTS/HPC/PF/22/0636 | HOHP/PF/14/0050 | HOHP/PF/14/0077 | HOHP/PF/14/0188 | HOHP/PF/13/0299
PF000522,N.B. Property Maintenance (Dundee) Ltd,N.B. Property Maintenance (Dundee) Ltd,Company,"Suite G1 Faraday Business Centre, 34 Faraday Street, Dundee, DD2 3QQ",Dundee,DD2 3QQ,,0,Registration expired on 12/10/2021,0,0,0,0,0,0,,,,0,0,0,0,0,0,0,0,0,0,0,0,0,0,0,,,
PF000569,Naver Ltd,Naver Ltd,Company,"Naver Business Centre, Naver House, Naver Road, THURSO, KW14 7QA",Naver Business Centre,KW14 7QA,https://www.naver.co.uk,13,Registered,0,0,0,0,0,0,,,,0,0,0,0,0,0,0,0,0,0,0,0,0,0,0,,,
PF001123,Nesstates Ltd,Nesstates Ltd,Company,"8 Church Street, Inverness, IV1 1AE",Inverness,IV1 1AE,,0,Registered,0,0,0,0,0,0,,,,0,0,0,0,0,0,0,0,0,0,0,0,0,0,0,,,
PF000485,Netkast Ltd,Netkast Ltd,Company,"31 Queens Road, Broxburn, EH52 5QZ",Broxburn,EH52 5QZ,,0,Registration expired on 26/09/2016,0,0,0,0,0,0,,,,0,0,0,0,0,0,0,0,0,0,0,0,0,0,0,,,
PF000816,New Findhorn Directions Ltd,New Findhorn Directions Ltd,Company,"New Findhorn Directions Ltd, Accounts Department, The Park, Findhorn, IV36 3TZ",New Findhorn Directions Ltd,IV36 3TZ,,0,Registration expired on 16/11/2022,0,0,0,0,0,0,,,,0,0,0,0,0,0,0,0,0,0,0,0,0,0,0,,,
PF000338,New Gorbals Housing Association Limited,New Gorbals Housing Association Limited,Registered Social Landlord,"200 Crown Street, Glasgow, G5 9AY",Glasgow,G5 9AY,https://www.newgorbalsha.org.uk,3949,Registered,0,0,0,0,0,0,,,,0,0,0,0,0,0,0,0,0,0,0,0,0,0,0,,,
PF000532,New Leaf Estate Management Ltd,New Leaf Estate Management Ltd,Company,"Drake House, Drake Lane, Dursley, GL11 4HH",Drake House,GL11 4HH,,0,Registration expired on 10/04/2017,0,0,0,0,0,0,,,,0,0,0,0,0,0,0,0,0,0,0,0,0,0,0,,,
PF000190,New Start Highland Enterprises Ltd,New Start Highland Enterprises Ltd,Company,"9 Carsegate Road North, Inverness, IV3 8DU",Inverness,IV3 8DU,,0,Registration expired on 08/12/2015,0,0,0,0,0,0,,,,0,0,0,0,0,0,0,0,0,0,0,0,0,0,0,,,
