registration_number,name,trading_name,trading_type,address,city,postcode,website,property_count,status,tribunal_total_cases,tribunal_negative_outcomes,tribunal_positive_outcomes,tribunal_neutral_outcomes,tribunal_pfeo_issued,tribunal_pfeo_proposed,tribunal_pfeo_resolved,tribunal_pfeo_unresolved,tribunal_pfeo_pending,tribunal_complied,tribunal_failure_to_comply,tribunal_dismissed,tribunal_rejected,tribunal_withdrawn,tribunal_other_outcomes,tribunal_upper_tribunal_appeals,tribunal_section_1_violations,tribunal_section_2_violations,tribunal_section_3_violations,tribunal_section_4_violations,tribunal_section_5_violations,tribunal_section_6_violations,tribunal_section_7_violations,tribunal_pf_duty_violations,tribunal_earliest_case,tribunal_latest_case,tribunal_case_refs
PF000108,Newton Property Management Ltd,Newton Property Management Ltd,Company,"87 Port Dundas Road, Glasgow, G4 0HF",Glasgow,G4 0HF,https://www.newtonproperty.co.uk,37033,Registered,40,23,16,1,2,4,9,6,5,9,5,2,5,0,13,4,13,17,13,7,6,12,10,20,2017-03-14,2025-11-12,FTS/HPC/PF/24/2727 | FTS/HPC/PF/24/3014 | FTS/HPC/PF/23/4574 | FTS/HPC/PF/23/4578 | FTS/HPC/PF/23/4579 | FTS/HPC/PF/23/4580 | FTS/HPC/PF/23/4582 | FTS/HPC/PF/23/4583 | FTS/HPC/PF/23/4584 | FTS/HPC/PF/23/4586 | FTS/HPC/LM/23/4475 | FTS/HPC/PF/24/2146 | FTS/HPC/PF/24/2145 | FTS/HPC/PF/24/5675 | FTS/HPC/PF/24/1556 | FTS/HPC/PF/24/0921 | FTS/HPC/PF/24/1954 | FTS/HPC/PF/23/2641 | FTS/HPC/PF/23/2645 | FTS/HPC/PF/24/0298 | FTS/HPC/PF/23/1912 | FTS/HPC/PF/23/0337 | FTS/HPC/PF/23/0006+0367 | FTS/HPC/PF/22/4041 | FTS/HPC/PF/23/1246 | FTS/HPC/PF/21/3219 | FTS/HPC/PF/22/2246 | FTS/HPC/PF/22/4172 | FTS/HPC/PF/22/4180 | FTS/HPC/LM/21/2188 | FTS/HPC/PF/21/1283 | FTS/HPC/PF/21/1412 | FTS/HPC/PF/21/1436 | FTS/HPC/PF/21/0429 | FTS/HPC/PF/20/2471 | FTS/HPC/PF/19/2260 | FTS/HPC/PF/19/2095 | FTS/HPC/PF/18/3536 | FTS/HPC/PF/19/2034 | FTS/HPC/LM/19/1004 | FTS/HPC/PF/19/0247 | FTS/HPC/PF/19/0247 | FTS/HPC/PF/17/0252 | FTS/HPC/PF/17/0297 | FTS/HPC/PF/17/0147 | HOHP/PF/16/0159 | HOHP/PF/16/0164 | FTS/HPC/PF/20/0514 | FTS/HPC/PF/22/1654/1655
PF000349,NG Property (Scotland) Limited,NG Property (Scotland) Limited,Company,"50 Reidhouse Street, Glasgow, G21 4LS",Glasgow,G21 4LS,https://nghomes.net/owners/,3044,Registered,1,0,0,1,0,0,0,0,0,0,0,0,0,0,1,0,0,0,1,0,0,0,0,1,2017-01-11,2017-01-11,HOHP/PF/16/0127
PF000474,Nivingston House Ltd,Nivingston House Ltd,Company,"Nivingston House, Nivingston, Cleish, Kinross, KY13 0LS",Nivingston House,KY13 0LS,,0,Registration expired on 23/09/2019,0,0,0,0,0,0,,,,0,0,0,0,0,0,0,0,0,0,0,0,0,0,0,,,
PF000263,North Ayrshire Council,North Ayrshire Council,Local Authority,"Cunninghame House, Friars Croft, Irvine, KA12 8EE",Cunninghame House,KA12 8EE,https://www.north-ayrshire.gov.uk,3057,Registered,0,0,0,0,0,0,,,,0,0,0,0,0,0,0,0,0,0,0,0,0,0,0,,,
PF000348,North Glasgow Housing Association Limited,North Glasgow Housing Association Limited,Registered Social Landlord,"50 Reidhouse Street, Springburn, Glasgow, G21 4LS",Springburn,G21 4LS,,0,Registration expired on 15/05/2025,1,1,0,0,0,0,0,0,0,0,0,0,0,0,1,0,0,0,0,0,0,0,0,0,2019-11-06,2019-11-06,FTS/HPC/PF/19/2326
PF000303,North Lanarkshire Council,North Lanarkshire Council,Local Authority,"Civic Centre, Windmillhill Street, Motherwell, ML1 1AB",Civic Centre,ML1 1AB,https://www.northlanarkshire.gov.uk,6010,Registered,0,0,0,0,0,0,,,,0,0,0,0,0,0,0,0,0,0,0,0,0,0,0,,,
PF000246,North View Housing Association Limited,North View Housing Association Limited,Registered Social Landlord,"29a Stravanan Road, Glasgow, G45 9LY",Glasgow,G45 9LY,https://www.nvha.org.uk,759,Registered,0,0,0,0,0,0,,,,0,0,0,0,0,0,0,0,0,0,0,0,0,0,0,,,
PF000847,Northwood Edinburgh Ltd,Northwood,Company,"13 Comely Bank Road, Edinburgh, EH4 1DR",Edinburgh,EH4 1DR,https://www.northwooduk.com/edinburgh-estate-agent,1,Registered,0,0,0,0,0,0,,,,0,0,0,0,0,0,0,0,0,0,0,0,0,0,0,,,
PF000759,NRV Management Glasgow Limited,NRV Management Glasgow Limited,Company,"Larmenier Centre, 162 East End Road, East Finchley, London, N2 0RU",Larmenier Centre,N2 0RU,,24,Registered,0,0,0,0,0,0,,,,0,0,0,0,0,0,0,0,0,0,0,0,0,0,0,,,
PF001142,NT1112 Home Owners Organisation,NT1112 Home Owners Organisation,Homeowners Association,"12 Newton Terrace, Glasgow, G3 7PJ",Glasgow,G3 7PJ,,0,Registered,0,0,0,0,0,0,,,,0,0,0,0,0,0,0,0,0,0,0,0,0,0,0,,,
PF000412,O'Neill Property,O'Neill Property,Sole Trader,"84 Berkeley Street, Glasgow, G3 7DS",Glasgow,G3 7DS,,0,Registration expired on 21/02/2017,0,0,0,0,0,0,,,,0,0,0,0,0,0,0,0,0,0,0,0,0,0,0,,,
PF000264,Oak Tree Housing Association Limited,Registered Social Landlord,Registered Social Landlord,"40 West Stewart Street, Greenock, PA15 1SH",Greenock,PA15 1SH,https://www.oaktreeha.org.uk/,1354,Registered,3,3,0,0,0,0,0,0,0,0,0,0,0,0,3,0,0,0,0,0,0,0,1,0,2015-12-17,2025-05-02,FTS/HPC/PF/24/3189 | HOHP/PF/15/0116 | FTS/HPC/PF/17/0311
PF000367,Ochil View Housing Association Ltd,Ochil View Housing Association Ltd,Registered Social Landlord,"Ochil House, Marshill, Alloa, FK10 1AB",Ochil House,FK10 1AB,https://www.ochilviewha.co.uk,42,Registered,0,0,0,0,0,0,,,,0,0,0,0,0,0,0,0,0,0,0,0,0,0,0,,,
PF001036,On Tranquil Shores Ltd,Melfort Pier Holidays,Company,"14 Craigmore Rd, Rothesay, PA20 9LB",Rothesay,PA20 9LB,https://www.mellowmelfort.com,19,Registered,0,0,0,0,0,0,,,,0,0,0,0,0,0,0,0,0,0,0,0,0,0,0,,,
PF000353,Orchard Brae Flats (Edinburgh) Ltd,Orchard Brae Flats (Edinburgh) Ltd,Company,"6/7 Orchard Brae Avenue, Edinburgh, EH4 2HP",Edinburgh,EH4 2HP,,0,Registration expired on 13/11/2015,0,0,0,0,0,0,,,,0,0,0,0,0,0,0,0,0,0,0,0,0,0,0,,,
PF000639,Ore Valley Housing Association Ltd,Ore Valley Housing Association Ltd,Registered Social Landlord,"114-116 Station Road, Cardenden, Fife, KY5 0BW",Cardenden,KY5 0BW,https://www.orevalleyha.org.uk,226,Registered,0,0,0,0,0,0,,,,0,0,0,0,0,0,0,0,0,0,0,0,0,0,0,,,
PF000281,Orkney Housing Association Ltd,Orkney Housing Association Ltd,Registered Social Landlord,"39a Victoria Street, Kirkwall, KW15 1DN",Kirkwall,KW15 1DN,https://www.ohal.org.uk,566,Registered,0,0,0,0,0,0,,,,0,0,0,0,0,0,0,0,0,0,0,0,0,0,0,,,
PF000738,Orkney Islands Property Developments Limited,Orkney Islands Property Developments Limited,Company,"4 Gunn's Close, Kirkwall, KW15 1DU",Kirkwall,KW15 1DU,https://www.oipdl.co.uk,272,Registered,0,0,0,0,0,0,,,,0,0,0,0,0,0,0,0,0,0,0,0,0,0,0,,,
PF000602,Ortus Facilities Management Ltd,Ortus Facilities Management Ltd,Company,"132 Dundonald Avenue, Johnstone, Pa5 0LP",Johnstone,PA5 0LP,,0,Registration expired on 11/06/2018,0,0,0,0,0,0,,,,0,0,0,0,0,0,0,0,0,0,0,0,0,0,0,,,
PF000128,Osprey Housing,Osprey Housing,Registered Social Landlord,"22 Abercrombie Court, Prospect Road, Westhill, AB32 6FE",Prospect Road,AB32 6FE,,0,Registration expired on 29/06/2022,0,0,0,0,0,0,,,,0,0,0,0,0,0,0,0,0,0,0,0,0,0,0,,,
PF001035,Overtoun Bowmont Limited,Johnson & Co Retirement Factor,Company,"7 Glen Sannox Loan, Craigmarloch, Glasgow, G68 0GD",Craigmarloch,G68 0GD,https://www.johnsonfactors.com,0,Registered,0,0,0,0,0,0,,,,0,0,0,0,0,0,0,0,0,0,0,0,0,0,0,,,
PF001116,Pada Vastu Ltd,Peace Palace Factor,Company,"Flat 1, 14 Clearburn Crescent, Edinburgh, EH16 5ER",Edinburgh,EH16 5ER,,9,Registered,0,0,0,0,0,0,,,,0,0,0,0,0,0,0,0,0,0,0,0,0,0,0,,,
PF000305,Paisley South Property Services Limited,Paisley South Property Services Limited,Company,"Assurance House, 2 Lawn Street, Paisley, PA1 1HA",Assurance House,PA1 1HA,https://www.paisleyha.org.uk,681,Registered,0,0,0,0,0,0,,,,0,0,0,0,0,0,0,0,0,0,0,0,0,0,0,,,
PF000840,Palm Integrated Solutions Ltd,Palm Integrated,Company,"272 Bath Street, Glasgow, G2 4JR",Glasgow,G2 4JR,,0,Registration expired on 05/10/2022,0,0,0,0,0,0,,,,0,0,0,0,0,0,0,0,0,0,0,0,0,0,0,,,
PF000996,Palms Property Management Ltd,Palms Property Management Ltd,Company,"Pitpointie Farm, Auchterhouse, Dundee, DD3 0QR",Pitpointie Farm,DD3 0QR,,24,Registered,0,0,0,0,0,0,,,,0,0,0,0,0,0,0,0,0,0,0,0,0,0,0,,,
PF001098,Pamsco Ltd,Tayside Local Factoring,Company,"125 Nethergate, Dundee, DD1 4DW",Dundee,DD1 4DW,,109,Registered,0,0,0,0,0,0,,,,0,0,0,0,0,0,0,0,0,0,0,0,0,0,0,,,
PF000282,Paragon Housing Association Ltd,Paragon Housing Association Ltd,Registered Social Landlord,"Invergrange House, Station Road, Grangemouth, FK3 8DG",Invergrange House,FK3 8DG,https://www.paragonha.org.uk,3517,Registered,0,0,0,0,0,0,,,,0,0,0,0,0,0,0,0,0,0,0,0,0,0,0,,,
PF000421,Paris Steele WS,Paris Steele WS,Partnership,"35 Westgate, North Berwick, EH39 4AG",North Berwick,EH39 4AG,,0,Registration expired on 18/06/2019,0,0,0,0,0,0,,,,0,0,0,0,0,0,0,0,0,0,0,0,0,0,0,,,
PF000423,Park Property Management Limited,Park Property Management Limited,Company,"16 North Claremont Street, Glasgow, G3 7LE",Glasgow,G3 7LE,https://www.parkpm.co.uk,7422,Registered,10,7,3,0,0,1,2,1,1,2,1,0,1,0,5,1,4,4,5,1,0,1,2,3,2017-05-25,2025-09-16,FTS/HPC/PF/24/2316 | FTS/HPC/PF/23/1674 | FTS/HPC/PF/18/1769 | FTS/HPC/LM/21/1520 | FTS/HPC/LM/19/2292 | FTS/HPC/PF/18/1810 | FTS/HPC/PF/17/0395 | FTS/HPC/LM/17/0260 | FTS/HPC/PF/17/0258 | FTS/HPC/PF/17/0101
PF000252,Parkhead Housing Association Limited,Parkhead Housing Association Limited,Registered Social Landlord,"40 Helenvale Street, Paisley, Glasgow, G31 4TF",Paisley,G31 4TF,https://www.parkheadha.org.uk,319,Registered,1,0,1,0,0,0,0,0,0,0,0,0,1,0,0,0,1,1,1,1,0,1,1,1,2020-03-28,2020-03-28,FTS/HPC/PF/20/0960
PF000165,Partick Works Limited,Partick Works Limited,Company,"10 Mansfield Street, Partick, Glasgow, G11 5QP",Partick,G11 5QP,https://www.partickha.org.uk,3219,Registered,3,2,1,0,0,0,0,0,0,0,0,1,0,0,2,0,0,1,0,1,0,1,1,1,2018-05-17,2023-10-24,"FTS/HPC/PF/23/1669 | FTS/HPC/PF/23/1162, 1163, 1164, 1165 + 1166 | FTS/HPC/PF/17/0418"
PF001112,Patawary Ltd,Patawary Ltd,Company,"467L Victoria Road, Glasgow, G42 8RL",Glasgow,G42 8RL,,0,Registered,0,0,0,0,0,0,,,,0,0,0,0,0,0,0,0,0,0,0,0,0,0,0,,,
PF001099,Pavillion Properties (Assets) Limited,Pavillion,Company,"India Buildings, 86 Bell Street, Dundee, DD1 1HN",India Buildings,DD1 1HN,https://pavillion.net,62,Registered,0,0,0,0,0,0,,,,0,0,0,0,0,0,0,0,0,0,0,0,0,0,0,,,
PF000486,Pavillion Properties (Scotland) Limited,Pavillion Properties (Scotland) Limited,Company,"India Buildings, 86 Bell Street, Dundee, DD1 1HN",India Buildings,DD1 1HN,,0,Registration expired on 13/08/2018,0,0,0,0,0,0,,,,0,0,0,0,0,0,0,0,0,0,0,0,0,0,0,,,
PF001039,Pavillion Properties Limited,Pavillion,Company,"India Buildings, 86 Bell Street, Dundee, DD1 1HN",India Buildings,DD1 1HN,https://www.pavillion.net,37,Registered,0,0,0,0,0,0,,,,0,0,0,0,0,0,0,0,0,0,0,0,0,0,0,,,
PF001049,Pennyarch Projects Ltd,Pennyarch Projects,Company,"Clyde Offices, 2nd Floor 48 West George Street, Glasgow, G2 1BP",Clyde Offices,G2 1BP,https://Www.pennyarch.com,0,Registered,0,0,0,0,0,0,,,,0,0,0,0,0,0,0,0,0,0,0,0,0,0,0,,,
PF000878,Pennyarch Projects Ltd,Pennyarch Projects Ltd,Company,"159 Lochview Drive, Glasgow, G33 1LN",Glasgow,G33 1LN,,0,Registration expired on 23/11/2023,0,0,0,0,0,0,,,,0,0,0,0,0,0,0,0,0,0,0,0,0,0,0,,,
PF000715,Pentland Community Enterprises Limited,Pentland Community Enterprises Limited,Company,"37 - 39 Traill Street, Thurso, KW14 8EG",Thurso,KW14 8EG,https://www.cairnha.com,70,Registered,0,0,0,0,0,0,,,,0,0,0,0,0,0,0,0,0,0,0,0,0,0,0,,,
PF000291,Pentland Housing Association,Pentland Housing Association,Registered Social Landlord,"37 - 39 Traill Street, Thurso, KW14 8EG",Thurso,KW14 8EG,,0,Registration expired on 22/07/2019,0,0,0,0,0,0,,,,0,0,0,0,0,0,0,0,0,0,0,0,0,0,0,,,
PF000395,Perth & Kinross Council,Perth & Kinross Council,Local Authority,"Communities - Housing, Pullar House, 35 Kinnoull Street, Perth, PH1 5GD",Communities - Housing,PH1 5GD,https://www.pkc.gov.uk,262,Registered,0,0,0,0,0,0,,,,0,0,0,0,0,0,0,0,0,0,0,0,0,0,0,,,
PF000729,Peter Cusack Property Consultancy Limited,Peter Cusack Property Consultancy Limited,Company,"Building 1, Spiersbridge Business Park, Thornliebank, Glasgow, G46 8NG",Spiersbridge Business Park,G46 8NG,,124,Registered,2,1,1,0,0,0,0,0,0,0,0,0,1,0,1,0,2,2,2,2,1,0,2,1,2021-10-20,2022-05-16,FTS/HPC/PF/22/0656 | FTS/HPC/PF/21/0689
PF001156,Peter Doherty,Doherty Roofing and Maintenance,Sole Trader,"12 John Burnside Drive, Clydebank, G81 5DY",Clydebank,G81 5DY,,0,Registered,0,0,0,0,0,0,,,,0,0,0,0,0,0,0,0,0,0,0,0,0,0,0,,,
PF001011,Philip Bald Accountancy Limited,Philip Bald Accountancy Limited,Company,"3b Ormiston Terrace, Edinburgh, EH12 7SJ",Edinburgh,EH12 7SJ,,104,Registered,0,0,0,0,0,0,,,,0,0,0,0,0,0,0,0,0,0,0,0,0,0,0,,,
PF000151,Pineview Housing Association Ltd,Pineview Housing Association Ltd,Registered Social Landlord,"5 Rozelle Avenue, Drumchapel, Glasgow, G15 7QR",Drumchapel,G15 7QR,https://www.pineview.org.uk,51,Registered,0,0,0,0,0,0,,,,0,0,0,0,0,0,0,0,0,0,0,0,0,0,0,,,
PF001010,Piper Lettings Ltd,Piper Lettings Ltd,Company,"29 York Place, Edinburgh, EH1 3HP",Edinburgh,EH1 3HP,,67,Registered,0,0,0,0,0,0,,,,0,0,0,0,0,0,0,0,0,0,0,0,0,0,0,,,
PF000123,Places for People Scotland Limited,Places for People Scotland Limited,Company,"1 Hay Avenue, Edinburgh, EH16 4RW",Edinburgh,EH16 4RW,,0,Registration expired on 01/04/2019,3,2,1,0,0,0,1,2,0,1,2,0,0,0,0,0,0,0,0,0,0,0,0,0,2016-07-12,2018-08-02,FTS/HPC/PF/18/0571 | FTS/HPC/PF/17/0329 | HOHP/PF/16/0022
PF000903,Platinum Property Management Limited,Platinum Property Management Limited,Company,"Mentor House,, Ainsworth Street,, Blackburn,, BB1 6AY","Mentor House,",BB1 6AY,,0,Registration expired on 05/03/2024,0,0,0,0,0,0,,,,0,0,0,0,0,0,0,0,0,0,0,0,0,0,0,,,
PF000756,PLS Rural Limited,PLS Rural Limited,Company,"8 Cornhill Way, Perth, PH1 1LJ",Perth,PH1 1LJ,https://www.plsrural.co.uk,56,Registered,1,1,0,0,1,0,0,0,1,0,0,0,0,0,0,0,1,1,0,0,0,0,1,1,2021-11-05,2021-11-05,FTS/HPC/PF/21/1957
PF000100,PMC Property Management & Lettings Ltd,PMC Property Management,Company,"PMC House, Little Square, Oldmeldrum, Inverurie, AB51 0AY",PMC House,AB51 0AY,https://www.pmcproperty.com,10599,Registered,4,2,2,0,0,0,2,1,0,2,1,0,0,0,1,0,2,3,0,0,2,2,2,3,2017-11-21,2020-09-16,FTS/HPC/PF/19/3413 | FTS/HPC/PF/18/1380 | FTS/HPC/PF/18/0477 | FTS/HPC/PF/17/0317
PF000662,Polaris Consulting International Limited,Polaris Consulting International Limited,Company,"4 Mardale Crescent, Edinburgh, EH10 5AG",Edinburgh,EH10 5AG,,0,Registration expired on 14/10/2019,0,0,0,0,0,0,,,,0,0,0,0,0,0,0,0,0,0,0,0,0,0,0,,,
PF000817,Positive Steps Partnership,Positive Steps,Company,"Swan House, 2 Explorer Road, Technology Park, Dundee, DD2 1DX",Swan House,DD2 1DX,,0,Registration expired on 15/05/2025,0,0,0,0,0,0,,,,0,0,0,0,0,0,0,0,0,0,0,0,0,0,0,,,
PF001014,Prem Apart Edinburgh Limited,Premier Suites PLUS Edinburgh Fountain Court,Company,"121 Grove Street, Edinburgh, EH3 8AA",Edinburgh,EH3 8AA,https://premiersuiteseurope.com,0,Registered,0,0,0,0,0,0,,,,0,0,0,0,0,0,0,0,0,0,0,0,0,0,0,,,
PF000503,Premier Developments Lochaber Ltd,Premier Developments Lochaber Ltd,Company,"Head Office, Woodland House, Torlundy, Fort William, PH33 6SW",Head Office,PH33 6SW,,0,Registration expired on 12/12/2016,0,0,0,0,0,0,,,,0,0,0,0,0,0,0,0,0,0,0,0,0,0,0,,,
PF000508,Premier Properties Perth Limited,Premier Properties Perth Limited,Company,"45 King Street, Perth, PH2 8JB",Perth,PH2 8JB,https://www.premierpropertiesperth.co.uk,9,Registered,0,0,0,0,0,0,,,,0,0,0,0,0,0,0,0,0,0,0,0,0,0,0,,,
PF001069,Principal Factors Ltd,Principal Factors,Company,"Clyde Offices, 2nd Floor, 48 West George Street, Glasgow, G2 1BP",Clyde Offices,G2 1BP,https://www.principalfactors.com,0,Registered,0,0,0,0,0,0,,,,0,0,0,0,0,0,0,0,0,0,0,0,0,0,0,,,
PF000921,Pritchard Lettings Limited,Pritchard Lettings Limited,Company,"1/5 Grandfield, Grandfield, Edinburgh, EH6 4TJ",Grandfield,EH6 4TJ,,0,Registration expired on 28/05/2024,0,0,0,0,0,0,,,,0,0,0,0,0,0,0,0,0,0,0,0,0,0,0,,,
PF000870,Pro-perty Development Scotland Ltd,Pro-perty Development Scotland Ltd,Company,"14 Parkhouse Street, Ayr, KA7 2HH",Ayr,KA7 2HH,,0,Registration expired on 17/07/2023,0,0,0,0,0,0,,,,0,0,0,0,0,0,0,0,0,0,0,0,0,0,0,,,
PF000186,ProAct Property Ltd,ProAct Property Ltd,Company,"17 Buchanan Drive, Cambuslang, Glasgow, G72 8BD",Cambuslang,G72 8BD,,0,Registration expired on 02/08/2022,0,0,0,0,0,0,,,,0,0,0,0,0,0,0,0,0,0,0,0,0,0,0,,,
PF000450,Property One (Scotland) Ltd,Property One (Scotland) Ltd,Company,"69 Buchanan St, Glasgow, G1 3HL",Glasgow,G1 3HL,,0,Registration expired on 29/03/2016,0,0,0,0,0,0,,,,0,0,0,0,0,0,0,0,0,0,0,0,0,0,0,,,
PF000204,Prospect Community Housing Ltd,Prospect Community Housing Ltd,Registered Social Landlord,"6 Westburn Avenue, Edinburgh, EH14 2TH",Edinburgh,EH14 2TH,https://www.prospectch.org.uk,169,Registered,1,1,0,0,0,0,0,0,0,0,0,0,0,0,1,0,0,0,0,0,0,0,0,1,2018-09-20,2018-09-20,FTS/HPC/LM/17/0427
PF000610,Prospect Property Factors Ltd,Prospect Property Factors Ltd,Company,"37 Hamilton Road, Bellshill, ML4 1AG",Hamilton,ML4 1AG,,0,Registration expired on 25/08/2021,0,0,0,0,0,0,,,,0,0,0,0,0,0,0,0,0,0,0,0,0,0,0,,,
PF000389,Provanhall Housing Association,Provanhall Housing Association,Registered Social Landlord,"34 Conisborough Road, Provanhall, Easterhouse, Glasgow, G34 9QG",Provanhall,G34 9QG,https://www.provanhallha.org.uk,16,Registered,0,0,0,0,0,0,,,,0,0,0,0,0,0,0,0,0,0,0,0,0,0,0,,,
PF000381,Quarriers,Quarriers,Company,"Quarriers Head Office, 20 St. Kenneth Drive, Glasgow, G51 4QD",Quarriers Head Office,G51 4QD,https://www.quarriers.org.uk,7,Registered,0,0,0,0,0,0,,,,0,0,0,0,0,0,0,0,0,0,0,0,0,0,0,,,
PF000418,Quartermile Estates Ltd,Quartermile Estates Ltd,Company,"9 Simpson Loan, Edinburgh, EH3 9GQ",Edinburgh,EH3 9GQ,,0,Registration expired on 15/11/2019,7,4,3,0,0,0,3,1,0,3,1,0,0,0,3,0,0,2,2,0,2,0,0,0,2015-12-18,2018-04-20,FTS/HPC/PF/17/0525 | HOHP/PF/16/0010 | HOHP/PF/16/0009 | HOHP/PF/15/0039 | HOHP/PF/15/0039 | HOHP/PF/16/0009 | HOHP/PF/16/0010
PF000258,Queens Cross Factoring Limited,Queens Cross Factoring Limited,Company,"45 Firhill Road, Glasgow, G20 7BA",Glasgow,G20 7BA,https://www.qcfactoring.co.uk,4924,Registered,1,0,0,1,0,0,0,0,0,0,0,0,0,0,1,0,0,0,1,0,0,1,0,1,2017-03-06,2017-03-06,HOHP/PF/16/0167
PF000394,Queens Cross Housing Association,Queens Cross Housing Association,Registered Social Landlord,"45 Firhill Road, Glasgow, G20 7BE",Glasgow,G20 7BE,,0,Registration expired on 04/05/2016,1,1,0,0,0,0,0,1,0,0,1,0,0,0,0,0,0,0,0,0,1,1,0,0,2019-03-07,2019-03-07,FTS/HPC/PF/18/2966
PF000148,Raeburn Hope,Raeburn Hope,Partnership,"77 Sinclair Street, Helensburgh, G84 8TG",Helensburgh,G84 8TG,,0,Registration expired on 17/01/2017,0,0,0,0,0,0,,,,0,0,0,0,0,0,0,0,0,0,0,0,0,0,0,,,
PF000710,RCB Property Services Limited,RCB Property Services Limited,Company,"Hattrick Farm, BRIDGE OF WEIR, PA11 3SF",Hattrick Farm,PA11 3SF,,0,Registration expired on 23/09/2020,0,0,0,0,0,0,,,,0,0,0,0,0,0,0,0,0,0,0,0,0,0,0,,,
PF000110,Redpath Bruce Property Management Limited,Redpath Bruce Property Management Limited,Company,"152 West Regent Street, Glasgow, G2 2RQ",Glasgow,G2 2RQ,https://www.redpathbruce.co.uk,12559,Registered,22,15,6,1,2,4,4,4,4,4,2,1,1,0,8,0,3,8,1,1,3,12,10,10,2013-06-11,2024-05-29,FTS/HPC/PF/23/2204 | FTS/HPC/PF/23/0716 + 0717 | FTS/HPC/PF/23/0716 + 0717 | FTS/HPC/PF/23/0716 + 0717 | FTS/HPC/PF/22/3665 | FTS/HPC/PF/22/2514 | FTS/HPC/PF/21/2636 | FTS/HPC/PF/22/1569 | FTS/HPC/PF/21/2587 | FTS/HPC/PF/21/1765 | FTS/HPC/PF/21/1613 | FTS/HPC/PF/21/0593 | FTS/HPC/GP/21/0005 | FTS/HPC/PF/21/0020 | FTS/HPC/PF/21/0042 | FTS/HPC/PF/21/0043 | FTS/HPC/PF/21/0044 | FTS/HPC/PF/21/0045 | FTS/HPC/PF/21/0047 | FTS/HPC/PF/18/1405 | FTS/HPC/PF/17/0398 | FTS/HPC/PF/17/0081 | FTS/HPC/PF/17/0082 | FTS/HPC/PF/17/0081.0082 | HOHP/PF/16/0012 | HOHP/PF/13/0051 | FTS/HPC/LA/23/0225
PF000633,Redwood Retreats Ltd,Redwood Retreats Ltd,Company,"Pitlivie Farm, Carnoustie, DD76LU",Pitlivie Farm,DD76LU,,0,Registration expired on 14/01/2022,0,0,0,0,0,0,,,,0,0,0,0,0,0,0,0,0,0,0,0,0,0,0,,,
PF000564,Regent Factor Ltd,Regent Factor Ltd,Company,"100 Maxwell Street, Glasgow, G1 4EQ",Glasgow,G1 4EQ,https://regentproperty.com/,61,Registered,0,0,0,0,0,0,,,,0,0,0,0,0,0,0,0,0,0,0,0,0,0,0,,,
PF000099,Reidvale Housing Association,Reidvale Housing Association,Registered Social Landlord,"13 Whitevale Street, Dennistoun, Glasgow, G31 1QW",Dennistoun,G31 1QW,https://reidvale.org.uk,825,Registered,0,0,0,0,0,0,,,,0,0,0,0,0,0,0,0,0,0,0,0,0,0,0,,,
PF000831,Rendall and Rittner Limited,Rendall and Rittner Limited,Company,"13b St George Wharf, London, SW8 2LE",London,SW8 2LE,https://www.rendallandrittner.co.uk,498,Registered,0,0,0,0,0,0,,,,0,0,0,0,0,0,0,0,0,0,0,0,0,0,0,,,
PF000284,Renfrewshire Council,Renfrewshire Council,Local Authority,"Renfrewshire House, Cotton Street, Paisley, PA1 1JD",Renfrewshire House,PA1 1JD,https://www.renfrewshire.gov.uk,2245,Registered,0,0,0,0,0,0,,,,0,0,0,0,0,0,0,0,0,0,0,0,0,0,0,,,
PF000923,RentirPro limited,Rentir,Company,"5 Maude Place, Kirkliston, EH29 9FH",Kirkliston,EH29 9FH,https://rentir.co.uk/,0,Registered,0,0,0,0,0,0,,,,0,0,0,0,0,0,0,0,0,0,0,0,0,0,0,,,
PF000111,Rentolease Property Management Ltd,Rentolease Property Management Ltd,Company,"123 Main Street, Prestwick, KA9 1LA",Prestwick,KA9 1LA,,476,Registered,4,2,2,0,0,0,2,1,0,2,1,0,0,0,1,0,2,2,0,0,0,2,0,2,2016-08-31,2025-03-19,FTS/HPC/PF/24/2025 | FTS/HPC/PF/22/0311 & FTS/HPC/PF/22/0312 | FTS/HPC/PF/22/0311 & FTS/HPC/PF/22/0312 | HOHP/PF/16/0080
PF000195,Residential Management Group Limited,Residential Management Group Limited,Company,"RMG House, Essex Road, Hoddesdon, EN11 0DR",RMG House,EN11 0DR,,0,Registration expired on 16/09/2019,4,3,1,0,1,0,0,2,1,0,2,0,1,0,0,1,1,3,2,1,1,2,3,1,2020-03-12,2022-01-14,FTS/HPC/PF/20/2019 | FTS/HPC/PF/20/2020 | FTS/HPC/PF/20/2021 | FTS/HPC/PF/20/2022 | FTS/HPC/PF/20/2023 | FTS/HPC/PF/20/2024 | FTS/HPC/PF/19/3399 | FTS/HPC/PF/19/3788 | FTS/HPC/PF/20/2008
PF000763,Residential Management Group Scotland Limited,Residential Management Group Scotland Limited,Company,"Unit 6, 95 Morrison Street, Glasgow, G5 8BE",Glasgow,G5 8BE,https://rmgscotland.com,11735,Registered,26,18,8,0,3,4,4,4,6,4,3,1,3,0,8,2,6,8,4,5,2,7,7,7,2020-10-07,2025-05-02,FTS/HPC/PF/23/1960 | FTS/HPC/PF/24/3113 | FTS/HPC/PF/23/4235 | FTS/HPC/PF/24/1474 | FTS/HPC/PF/23/4212 | FTS/HPC/PF/23/3843 | FTS/HPC/PF/24/1497 | FTS/HPC/PF/23/3095 | FTS/HPC/LM/23/2092 | FTS/HPC/PF/22/4515 | FTS/HPC/LM/22/2043 | FTS/HPC/PF/22/2276 | FTS/HPC/LM/22/3184 | FTS/HPC/LM/22/2880 | FTS/HPC/LM/22/1998 | FTS/HPC/PF/21/2591 | FTS/HPC/PF/21/2332 | FTS/HPC/PF/21/2011 | FTS/HPC/PF/21/2459 | FTS/HPC/LM/21/0290 | FTS/HPC/PF/20/2100 | FTS/HPC/PF/20/2100 | FTS/HPC/PF/20/2100 | FTS/HPC/PF/20/1396 | FTS/HPC/PF/20/1383 | FTS/HPC/PF/20/1383 | FTS/HPC/PF/23/1169
PF000954,Reu-Lake Properties Ltd,Reu-Lake Properties Ltd,Company,"87 Albion Street, Coatbridge, ML5 3SD",Coatbridge,ML5 3SD,,0,Registration expired on 13/02/2025,0,0,0,0,0,0,,,,0,0,0,0,0,0,0,0,0,0,0,0,0,0,0,,,
PF000871,Ritchie Leasing Limited,Ritchie Leasing Ltd,Company,"3 Market Square, Stonehaven, AB39 2BT",Stonehaven,AB39 2BT,https://www.ritchieleasing.co.uk,9,Registered,0,0,0,0,0,0,,,,0,0,0,0,0,0,0,0,0,0,0,0,0,0,0,,,
PF000152,River Clyde Homes,River Clyde Homes,Company,"Clyde View, 22 Pottery Street, Greenock, PA15 2UZ",Clyde View,PA15 2UZ,https://www.riverclydehomes.org.uk,4682,Registered,23,16,7,0,2,3,3,4,3,3,2,0,4,0,9,0,2,11,5,2,2,7,5,9,2014-02-21,2025-11-19,FTS/HPC/PF/24/2710 | FTS/HPC/PF/24/4033 | FTS/HPC/PF/22/4175 | FTS/HPC/PF/23/0097 | FTS/HPC/PF/22/4270 | FTS/HPC/PF/23/0064 | FTS/HPC/PF/22/4174 | FTS/HPC/PF/23/0028 | FTS/HPC/PF/21/2823 & FTS/HPC/PF/21/2535 | FTS/HPC/PF/21/1833 | FTS/HPC/PF/21/1295 | FTS/HPC/PF/21/1547 | FTS/HPC/PF/21/0327 | FTS/HPC/PF/21/0795 | FTS/HPC/PF/19/3715 | FTS/HPC/PF/18/2024 | FTS/HPC/PF/18/2148 | FTS/HPC/PF/17/0281 | FTS/HPC/PF/17/0281 | FTS/HPC/PF/17/0142 | HOHP/PF/13/0234 | FTS/HPC/PF/19/2316 | FTS/HPC/PF/19/2316 | FTS/HPC/PF/20/2314
PF000780,RM Lettings & Sales Ltd,RM Lettings & Sales Ltd,Company,"71, Milton Road, Kirkcaldy, KY1 1TP",Milton Road,KY1 1TP,,0,Registration expired on 17/08/2021,0,0,0,0,0,0,,,,0,0,0,0,0,0,0,0,0,0,0,0,0,0,0,,,
PF000166,Robert Murray,Lickley Proctor Lettings,Sole Trader,"58 Bell Street, Dundee, DD1 1HF",Dundee,DD1 1HF,,0,Registration expired on 09/02/2022,0,0,0,0,0,0,,,,0,0,0,0,0,0,0,0,0,0,0,0,0,0,0,,,
PF000463,Robert Smith,Property Management Options,Sole Trader,"6 Robert Street, Port Glasgow, PA14 5NU",Glasgow,PA14 5NU,,22,Registered,0,0,0,0,0,0,,,,0,0,0,0,0,0,0,0,0,0,0,0,0,0,0,,,
PF000524,Robertson Property Management Limited,Robertson Property Management Limited,Company,"76 East Dock Street, Dundee, DD1 3LH",Dundee,DD1 3LH,https://www.robertsonpm.co.uk,386,Registered,1,0,1,0,0,0,0,0,0,0,0,0,1,0,0,0,1,1,0,0,0,0,1,0,,,
PF000133,Robin Williamson,Sharp and Fairlie,Sole Trader,"103 Douglas Street, Glasgow, G2 4HA",Glasgow,G2 4HA,,0,Registration expired on 24/08/2022,0,0,0,0,0,0,,,,0,0,0,0,0,0,0,0,0,0,0,0,0,0,0,,,
PF000782,Rockford Properties Ltd,Rockford Properties Ltd,Company,"50 Castle Street, Dundee, DD1 3AQ",Dundee,DD1 3AQ,https://www.rockfordproperties.co.uk,69,Registered,1,1,0,0,0,0,0,0,0,0,0,0,0,0,1,0,0,0,0,0,0,1,1,1,,,FTS/HPC/PF/20/1501
PF000601,Rockford Properties Ltd,Rockford Properties Ltd,Company,"50 Castle Street, Dundee, DD1 3AQ",Dundee,DD1 3AQ,,0,Registration expired on 13/08/2018,0,0,0,0,0,0,,,,0,0,0,0,0,0,0,0,0,0,0,0,0,0,0,,,
PF000136,Roger G Dodd & Company,Roger G Dodd & Company,Sole Trader,"Bridge Street, Kelso, TD5 7JD",Bridge Street,TD5 7JD,,0,Registration expired on 03/12/2018,0,0,0,0,0,0,,,,0,0,0,0,0,0,0,0,0,0,0,0,0,0,0,,,
PF000167,Rollos Town & Gown Limited,Rollos Town & Gown Limited,Company,"114 South Street, St Andrews, KY16 9QD",St Andrews,KY16 9QD,,0,Registration expired on 11/06/2019,0,0,0,0,0,0,,,,0,0,0,0,0,0,0,0,0,0,0,0,0,0,0,,,
PF000272,Rosehill Housing Co-operative Limited,Rosehill Housing Co-operative Limited,Registered Social Landlord,"250 Peat Road, Pollok, Glasgow, G53 6SA",Pollok,G53 6SA,,274,Registered,0,0,0,0,0,0,,,,0,0,0,0,0,0,0,0,0,0,0,0,0,0,0,,,
