registration_number,name,trading_name,trading_type,address,city,postcode,website,property_count,status
PF000924,34 Camphill Avenue Owners Association,34 Camphill Avenue Owners Association,Other Legal Status,"1/2 34 Camphill Avenue, Glasgow, G41 3AZ",Glasgow,G41 3AZ,,8,Registered
PF000567,4C Scotland Limited,4C Scotland Limited,Company,"29 Lonmay Place, Panorama Business Village, Glasgow, G33 4ER",Panorama Business Village,G33 4ER,,0,Registration expired on 24/05/2017
PF001067,7 Days Property,7 Days Property,Partnership,"157 Kilmarnock Road, Glasgow, G41 3JE",Kilmarnock,G41 3JE,,72,Registered
PF000622,91BC Property Services Limited,91BC Property Services Limited,Company,"Garscadden House, 3 Dalsetter Crescent, Dalsetter Crescent, Glasgow, G15 8TG",Garscadden House,G15 8TG,https://www.91bc.uk,4505,Registered
PF000147,A & K Property Management Services,A & K Property Management Services,Company,"240 Wallace Street, Kingston Quay, Glasgow, G5 8AS",Kingston Quay,G5 8AS,,0,Registration expired on 16/11/2015
PF000723,A W Middleton,Longford Property Management,Partnership,"Longford Farm, West Calder, EH55 8NS",Longford Farm,EH55 8NS,,20,Registered
PF000776,A&H Developments (Killin) Ltd,A&H Developments (Killin) Ltd,Company,"7 Lochay Road, Killin, FK21 8TB",Killin,FK21 8TB,,0,Registration expired on 13/07/2021
PF000549,A+ Property Management,A+ Property Management,Sole Trader,"229 Portobello High Street, Edinburgh, EH15 2AN",Edinburgh,EH15 2AN,,0,Registration expired on 27/04/2018
PF000530,Abacus Property Factors Ltd,Abacus Property Factors Ltd,Company,"11 South Street, Dalkeith, EH22 1AH",Dalkeith,EH22 1AH,,98,Registered
PF001065,Abba Land and Property Limited,Abba Land and Property Limited,Company,"15 Newton Terrace, Charing Cross, Glasgow, G3 7PJ",Charing Cross,G3 7PJ,,17,Registered
PF000534,Abbey Construction (Scotland) Ltd,Abbey Construction (Scotland) Ltd,Company,"8 Newlands Place, East Kilbride, Glasgow, G74 1AE",East Kilbride,G74 1AE,https://www.aconstruction.co.uk,15,Registered
PF000256,Abbey Forth Property Management Limited,Abbey Forth Property Management Limited,Company,"Laich House, 5 Castle Court, Carnegie Campus, Dunfermline, KY11 8PB",Laich House,KY11 8PB,https://www.abbeyforth.co.uk,67,Registered
PF000342,ABE Factors Ltd,ABE Factors Ltd,Company,"Block 3 Unit 10, Tollcross Industrial Estate, Causewayside Street, Glasgow, G32 8LP",Tollcross Industrial Estate,G32 8LP,,73,Registered
PF000255,Aberdeen City Council,Aberdeen City Council,Local Authority,"Early Intervention and Community Empowerment, Marischal College, Business Hub 11, Broad Street, Aberdeen, AB10 1AB",Broad Street,AB10 1AB,,3155,Registered
PF000270,Aberdeen Property Leasing Limited,Aberdeen Property Leasing Limited,Company,"Rosemount House, 138-140 Rosemount Place, Aberdeen, AB25 2YU",Rosemount House,AB25 2YU,,0,Registration expired on 30/06/2025
PF000371,Aberdeenshire Council,Aberdeenshire Council,Local Authority,"Woodhill House, West Burn Road, Aberdeen, AB16 5GB",Woodhill House,AB16 5GB,https://www.aberdeenshire.gov.uk,6,Registered
PF000130,Aberdein Considine,Aberdein Considine,Partnership,"5-9 Bon Accord Crescent, Aberdeen, AB11 6DN",Aberdeen,AB11 6DN,,0,Registration expired on 25/04/2022
PF000206,Abertay Housing Association Ltd,Abertay Housing Association Ltd,Registered Social Landlord,"147 Fintry Drive, Dundee, DD4 9HE",Dundee,DD4 9HE,https://www.abertayha.co.uk,3993,Registered
PF001129,Abiconn Ltd,Abiconn Ltd,Company,"94 Duke Street, Glasgow, G4 0UW",Glasgow,G4 0UW,,0,Registered
PF000861,AboveBoard Homes Ltd,AboveBoard,Company,"5 South Charlotte Street, Edinburgh, EH2 4AN",Edinburgh,EH2 4AN,https://www.aboveboard.homes,433,Registered
PF000607,ABZ Property Investment Leasing Ltd,ABZ Property Investment Leasing Ltd,Company,"30 Earlspark Drive, Bieldside, Aberdeen, AB15 9AH",Bieldside,AB15 9AH,,0,Registration expired on 09/07/2018
PF000943,Acre Lettings Ltd,Acre Lettings Ltd,Company,"6 Stanlane Place, Largs, KA30 8DA",Largs,KA30 8DA,,39,Registered
PF000516,Actual Property,Actual Property,Sole Trader,"33a Durham Road, Edinburgh, EH15 1PB",Edinburgh,EH15 1PB,,0,Registration expired on 23/01/2017
PF001092,Afton Builders Limited,Afton Builders Limited,Company,"Bank Chambers, The Square, Cumnock, Cumnock, KA18 1AT",Bank Chambers,KA18 1AT,,19,Registered
PF001091,AGM Property Management,AGM Property Management,Company,"7 Craigmuir Drive, Bishopton, PA7 5GD",Bishopton,PA7 5GD,https://Agmpm.co.uk,0,Registered
PF000496,Ainsley Smith & Co Ltd,Ainsley Smith & Co Ltd,Company,"21 Argyll Square, Oban, PA34 4AT",Oban,PA34 4AT,https://www.ainsleysmith.co.uk,5,Registered
PF001013,AJM Property Management Services Ltd,AJM Property Management Services Ltd,Company,"Suite 10-12 Mezzanine Floor, Royal Liver Building, Liverpool, L3 1HU",Royal Liver Building,L3 1HU,,0,Registered
PF000983,ALAN A HAXTON,ALAN A HAXTON,Sole Trader,"3 Laverockdale Park, Edinburgh, EH13 0QE",Edinburgh,EH13 0QE,,14,Registered
PF000672,Alan A Haxton FRICS,Alan A Haxton FRICS,Sole Trader,"3 Laverockdale Park, Colinton, EDINBURGH, EH13 0QE",Colinton,EH13 0QE,,0,Registration expired on 07/09/2022
PF000875,Alan Gebbie,AFS (Ayrshire Factoring Services),Sole Trader,"62 Beach Road, Troon, KA10 6SX",Troon,KA10 6SX,,11,Registered
PF000477,Alan Sneddon,Sneddon Property Management,Sole Trader,"9 St Andrews Road, Renfrew, PA4 0SN",Renfrew,PA4 0SN,,0,Registered
PF000998,Alanna Properties Ltd,Alanna Properties Ltd,Company,"1 Media Board Suite First Floor, Britannia Street, Leicester, LE1 3LE",Britannia Street,LE1 3LE,,0,Registered
PF000596,Albyn Enterprises Ltd,Albyn Enterprises Ltd,Company,"98-100 High Street, Invergordon, IV18 0DL",Invergordon,IV18 0DL,,0,Registration expired on 24/09/2018
PF000182,Albyn Housing Society Limited,Albyn Housing Society Limited,Registered Social Landlord,"98-104 High Street, Invergordon, IV18 0DL",Invergordon,IV18 0DL,,0,Registration expired on 02/11/2015
PF000670,Alderglen Factor Association,Alderglen Factor Association,Other Legal Status,"30 Abercrombie Drive, Glasgow, G61 4RR",Glasgow,G61 4RR,,37,Registered
PF001133,Alex Mitchell Factoring,Alex Mitchell Factoring,Sole Trader,"9 Cottown of Balgownie, Aberdeen, AB23 8JQ",Aberdeen,AB23 8JQ,,0,Registered
PF000521,Alison Bruce Property Management Ltd,Alison Bruce Property Management Ltd,Company,"77 Macalpine Road, Dundee, DD3 8RE",Dundee,DD3 8RE,https://www.alisonbruceproperty.com,360,Registered
PF000470,Allied Souter & Jaffrey Limited,Allied Souter & Jaffrey Limited,Company,"Lyle House, Pavillion 1, Fairways Business Park, Inverness, IV2 6AA",Lyle House,IV2 6AA,,0,Registration expired on 30/09/2019
PF000134,Allsop Letting & Management,Allsop Letting & Management,Company,"Princes's House, 53-54 Queen's Road, Brighton, BN1 3XB",Princes's House,BN1 3XB,,0,Registration expired on 23/06/2016
PF000181,Almond Housing Association Limited,Almond Housing Association Limited,Registered Social Landlord,"New Almond House, 44 Etive Walk, Craigshill, Livingston, EH54 5AB",New Almond House,EH54 5AB,https://www.almondha.org.uk,176,Registered
PF000661,Amfactoring Limited,Amfactoring Limited,Company,"Unit 9 -11, RFL House, Anderson Street, Dunblane, FK15 9AJ",Anderson Street,FK15 9AJ,,0,Registration expired on 28/07/2022
PF000346,ANCHO Ltd,ANCHO Ltd,Registered Social Landlord,"Sovereign House, Academy Road, Irvine, KA12 8RL",Sovereign House,KA12 8RL,https://www.ancho.co.uk,472,Registered
PF000325,Anderson Banks,Anderson Banks,Sole Trader,"22 Argyll Square, Oban, PA34 4AT",Oban,PA34 4AT,,0,Registration expired on 02/11/2015
PF000380,Angus Council Housing Division,Angus Council Housing Division,Local Authority,"Angus House, Orchard Loan, Orchardbank, Forfar, DD8 1AN",Angus House,DD8 1AN,,0,Registration expired on 13/05/2022
PF001064,Angus Glen Properties Ltd,Angus Glen Properties Ltd,Company,"18 South Tay Street, Dundee, DD1 1PD",Dundee,DD1 1PD,https://www.angusglenproperties.com,0,Registered
PF000129,Angus Housing Association Limited,Angus Housing Association Limited,Registered Social Landlord,"93 High Street, Arbroath, DD11 1DP",Arbroath,DD11 1DP,https://www.angusha.org.uk,1495,Registered
PF000341,Annan Associates Limited,Annan Associates Limited,Company,"229 Portobello High Street, Edinburgh, EH15 2AN",Edinburgh,EH15 2AN,,0,Registration expired on 13/09/2017
PF001125,Annan Property Factors Limited,Annan Property Factors Limited,Company,"268 Portobello High Street, Edinburgh, EH15 2AT",Edinburgh,EH15 2AT,,0,Registered
PF000392,Anne Gordon,Anne Gordon,Sole Trader,"97 Milngavie Road, Glasgow, G61 2EL",Glasgow,G61 2EL,https://www.agpmscotland.co.uk,647,Registered
PF000377,Antonine Housing Association,Antonine Housing Association,Registered Social Landlord,"3 Cowgate, Kirkintilloch, Glasgow, G66 1HW",Kirkintilloch,G66 1HW,,0,Registration expired on 04/03/2019
PF000383,Apex Property Factor Limited,Apex Property Factor Limited,Company,"46 Eastside, Kirkintilloch, Kirkintilloch, G66 1QH",Kirkintilloch,G66 1QH,,0,Registration expired on 13/01/2020
PF000709,Aquila Management Services Limited,Aquila Management Services Limited,Company,"98 High Street, Airdrie, ML6 0DX",Airdrie,ML6 0DX,https://www.aquilams.com,0,Registered
PF001082,Aquila Management Services Property Factoring Ltd,Aquila Management Services Property Factoring Ltd,Company,"98 High Street, Airdrie, ML6 0DX",Airdrie,ML6 0DX,https://www.aquilams.com,686,Registered
PF000513,Archerfield House Hotel Management Limited,Archerfield House Hotel Management Limited,Company,"Archerfield Links, Golf Clubhouse, Golf Green, Dirleton, EH39 5HU",Archerfield Links,EH39 5HU,,103,Registered
PF000708,Arden Property Management LLP,Arden Property Management LLP,Other Legal Status,"43 Morningside Road, Edinburgh, EH10 4DR",Edinburgh,EH10 4DR,,0,Registration expired on 14/03/2023
PF000168,Ardenglen Housing Association Ltd,Ardenglen Housing Association Ltd,Registered Social Landlord,"355 Tormusk Road, Castlemilk, G45 0HF",Castlemilk,G45 0HF,https://www.ardenglen.co.uk,61,Registered
PF000302,Argyll Community Housing Association Limited,Argyll Community Housing Association Limited,Registered Social Landlord,"Menzies House, Glenshellach Business Park, Oban, PA34 4RY",Menzies House,PA34 4RY,https://www.acha.co.uk,7270,Registered
PF001070,Argyll Letting Services Limited,Argyll Letting Services Limited,Company,"64 John Street, Dunoon, PA23 8BJ",Dunoon,PA23 8BJ,https://www.argyll-letting.co.uk,12,Registered
PF000408,Arklet Housing Association Ltd,Arklet Housing Association Ltd,Registered Social Landlord,"Arklet Housing Association Ltd, Barrland Court, Barrland Drive, Giffnock, G46 7QD",Giffnock,G46 7QD,,0,Registration expired on 22/07/2022
PF000926,ASC Asset Management (EK) Ltd,MPM Property,Company,"29 Tennant Avenue, College Milton Industrial Park, East Kilbride, Glasgow, G74 5NA",East Kilbride,G74 5NA,https://www.mpmscotland.co.uk,70,Registered
PF000254,Aspect Residential Property Management Ltd,Aspect Residential Property Management Ltd,Company,"17/1 Silvermills Court, Henderson Place Lane, Edinburgh, EH3 5DG",Henderson Place Lane,EH3 5DG,,0,Registration expired on 08/12/2015
PF000745,ATB Accountancy Services Limited,ATB Accountancy Services Limited,Company,"125a Dalrymple Street, Dalrymple Street, Girvan, KA26 9BS",Dalrymple Street,KA26 9BS,,0,Registration expired on 16/10/2020
PF001120,Athene Associates,Athene Associates,Company,"37A Sidegate, Haddington, East Lothian, EH41 4BU",Haddington,EH41 4BU,https://www.atheneassociates.co.uk,0,Registered
PF000316,Atholls Ltd,Atholls Ltd,Company,"16 North Silver Street, Aberdeen, AB10 1RL",Aberdeen,AB10 1RL,,0,Registration expired on 08/04/2025
PF000189,Atrium Initiatives Limited,Atrium Initiatives Limited,Company,"Atrium House, 14 Central Avenue, Kilmarnock, KA1 4PS",Atrium House,KA1 4PS,https://www.choice-places.co.uk,2175,Registered
PF001144,Augusto Barale,The Honest Factor Company,Sole Trader,"2/1 54 Grierson Street, Glasgow, G33 2EN",Glasgow,G33 2EN,,0,Registered
PF000978,Avongreen Abodes Ltd,Avongreen Abodes Ltd,Company,"70 Carlisle Road, Hamilton, ML3 7TX",Hamilton,ML3 7TX,,5,Registered
PF000990,AWM CONSTRUCTION (SCOTLAND) LTD,AWM CONSTRUCTION (SCOTLAND) LTD,Company,"12 Newhouses Road, Burnside, Broxburn, EH52 5NZ",Burnside,EH52 5NZ,https://awm-construction.co.uk/,0,Registered
PF000260,Ayrshire Housing,Ayrshire Housing,Registered Social Landlord,"119 Main Street, Ayr, KA8 8BX",Ayr,KA8 8BX,https://www.ayrshirehousing.org.uk,949,Registered
PF000664,Ayrshire Letting and Sales Limited,Ayrshire Letting and Sales Limited,Company,"26 Ritchie St, West Kilbride, KA23 9AL",West Kilbride,KA23 9AL,,0,Registration expired on 14/01/2020
PF000141,B & B Estate Agents,B & B Estate Agents,Sole Trader,"16 Station Road, Dumbarton, G82 1QB",Dumbarton,G82 1QB,,0,Registration expired on 02/11/2015
PF000849,B.H.C Limited,BHC LTD,Company,"Medwyn Park, Carnwath, Lanark, ML11 8HS",Medwyn Park,ML11 8HS,,0,Registration expired on 21/02/2023
PF000218,BA Professional Advisory Services Limited,BA Professional Advisory Services Limited,Company,"3 Craigdoon House, 2 Dunure Road, Ayr, KA7 4HR",Ayr,KA7 4HR,,0,Registration expired on 02/12/2015
PF000414,Bailey Park Productions Limited,Bailey Park Productions Limited,Company,"213 Fenwick Road, Giffnock, Glasgow, G46 6JD",Giffnock,G46 6JD,,0,Registration expired on 18/03/2019
PF000949,Balmore Estates (Scotland) Ltd,Balmore Property Management,Company,"Abercorn House, 79 Renfrew Rd, Paisley, PA3 4DA",Abercorn House,PA3 4DA,,0,Registration expired on 08/04/2025
PF000969,Barrhead Housing Association Limited,Barrhead Housing Association Limited,Registered Social Landlord,"60-70 Main Street, Barrhead, G78 1SB",Barrhead,G78 1SB,https://barrheadha.org/,461,Registered
PF000435,Bastion Property Management Ltd,Bastion Property Management Ltd,Company,"33 Upper Craigs, Stirling, FK8 2DG",Stirling,FK8 2DG,https://www.bastionpropertymanagement.com,16,Registered
PF000311,Be Factored Ltd,Be Factored Ltd,Company,"2a North Kirklands, Eaglesham Road, Glasgow, G76 0NT",Eaglesham Road,G76 0NT,,0,Registration expired on 10/11/2016
PF000312,Be Maintained,Be Maintained,Company,"2a North Kirklands, Eaglesham Road, Glasgow, G76 0NT",Eaglesham Road,G76 0NT,,0,Registration expired on 10/11/2016
PF000845,Beacon Brooke Limited,Beacon Brooke Limited,Company,"216 West George Street, Glasgow, G2 2PQ",Glasgow,G2 2PQ,,0,Registration expired on 29/11/2022
PF001149,Beechside Properties Ltd,Beechside Properties Ltd,Company,"Beechside House, Auchry, Turriff, AB53 5TG",Beechside House,AB53 5TG,,0,Registered
PF000626,Bell Ingram LLP,Bell Ingram LLP,Partnership,"Durn, Isla Road, Perth, PH2 7HF",Durn,PH2 7HF,,135,Registered
PF000266,Bellsmyre Housing Association,Bellsmyre Housing Association,Registered Social Landlord,"16 Merkins Avenue, Bellsmyre, Dumbarton, G82 3EB",Bellsmyre,G82 3EB,,0,Registration expired on 25/10/2022
PF000439,Belvoir Lettings Inverness,Belvoir Lettings Inverness,Company,"18 Queensgate, Inverness, IV1 1DJ",Inverness,IV1 1DJ,,0,Registration expired on 04/05/2016
PF000539,Belvoir Lettings(Moray) Ltd,Belvoir Lettings(Moray) Ltd,Company,"22 Thunderton Place, Elgin, IV30 1BG",Elgin,IV30 1BG,,0,Registration expired on 20/06/2023
PF000721,BeneFactors Property Management Limited,BeneFactors Property Management Limited,Company,"7 Queens Gardens, Aberdeen, AB15 4YD",Aberdeen,AB15 4YD,https://www.benefactorsproperty.co.uk,262,Registered
PF000146,Bield Housing & Care,Bield Housing & Care,Registered Social Landlord,"79 Hopetoun Street, Edinburgh, EH7 4QF",Edinburgh,EH7 4QF,https://www.bield.co.uk,91,Registered
PF000446,Black Hay,Black Hay,Partnership,"45-47 Main Street, Prestwick, KA9 1AF",Prestwick,KA9 1AF,,0,Registration expired on 21/06/2022
PF000422,Blackadders LLP,Blackadders LLP,Partnership,"34 Reform Street, Dundee, DD1 1RJ",Dundee,DD1 1RJ,,0,Registration expired on 10/07/2025
PF000298,Blackwood Homes & Care,Blackwood Homes & Care,Registered Social Landlord,"160 Dundee Street, Edinburgh, EH11 1DQ",Dundee,EH11 1DQ,,0,Registration expired on 09/09/2025
PF000276,Blairtummock Housing Association Limited,Blairtummock Housing Association Limited,Registered Social Landlord,"45 Boyndie Street, Easterhouse, Glasgow, G34 9JL",Easterhouse,G34 9JL,http://www.scottishhousingconnections.org/HA/Blair,96,Registered
PF000257,Blochairn Housing Association Ltd,Blochairn Housing Association Ltd,Registered Social Landlord,"1 Blochairn Road, Glasgow, G21 2ED",Glasgow,G21 2ED,https://www.blochairn.org,31,Registered
PF000441,Block Property Management Ltd,Block Property Management Ltd,Company,"1-3 St Marys Place, Bury, BL9 0DZ",Bury,BL9 0DZ,https://www.blockpropertymanagement.com,2,Registered
PF001101,Blocsphere Property Management,Blocsphere Property Management,Company,"Derwent House, Eco Park Road, Ludlow, Shropshire, SY8 1FF",Derwent House,SY8 1FF,https://blocsphere.co.uk/,0,Registered
PF000869,Blosshome Property Management Ltd,Blosshome Property Management,Company,"18 Castle Street, Port Bannatyne, PA20 0ND",Port Bannatyne,PA20 0ND,,22,Registered
PF000449,Blythswood Property Management Ltd,Blythswood Property Management Ltd,Company,"Munro House, Quarrywood Court, Livingston, EH54 6AX",Munro House,EH54 6AX,https://www.blythswoodpm.co.uk,680,Registered
PF000714,Bondsave Limited,Braemore Sales & Lettings,Company,"Orchard Brae House, Level 2, 30 Queensferry Road, Edinburgh, EH4 2HS",Orchard Brae House,EH4 2HS,,0,Registration expired on 18/04/2023
PF000244,Boomerang Factoring,Boomerang Factoring,Company,"534 CROW ROAD, GLASGOW, G13 1NU",Glasgow,G13 1NU,,0,Registration expired on 03/11/2015
PF000720,Bowbridge Properties (UK) Limited,Bowbridge Properties (UK) Limited,Company,"7 Balmossie Green, Broughty Ferry, Dundee, DD5 3GD",Broughty Ferry,DD5 3GD,,0,Registration expired on 15/04/2020
PF001016,Bowman Rebecchi Limited,Bowman Rebecchi Limited,Company,"Suite 2, 32-36 Kempock Street, Gourock, PA19 1NA",Gourock,PA19 1NA,https://www.bowmanrebecchi.com,16,Registered
PF000462,Braemar Estates Limited,Braemar Estates Limited,Company,"BRAEMAR ESTATES, RICHMOND HOUSE, HEATH ROAD, HALE, WA14 2XP",BRAEMAR ESTATES,WA14 2XP,,0,Registration expired on 04/11/2019
PF000706,BRD Property Ltd,BRD Property Ltd,Company,"Flat 4 , Barron house, 88 high street, Nairn, IV12 4AU",Nairn,IV12 4AU,,0,Registration expired on 18/01/2023
PF000719,Brian Stewart,BS Properties,Sole Trader,"23 South Tay Street, Dundee, DD1 1NR",Dundee,DD1 1NR,https://www.bs-properties.co.uk,0,Registered
PF000105,Bridgewater Housing Association Limited,Bridgewater Housing Association Limited,Registered Social Landlord,"Ground Floor West, India of Inchinnan, Greenock Road, Inchinnan, PA4 9LH",Ground Floor West,PA4 9LH,https://www.bridgewaterha.org.uk,2686,Registered
PF000906,Brio Retirement Living (Chapelton) Limited,Brio Retirement Living (Chapelton) Limited,Company,"1 Hay Avenue, Edinburgh, EH16 4RW",Edinburgh,EH16 4RW,https://www.brioretirement.co.uk/,26,Registered
PF000830,Brio Retirement Living (Holdings) Limited,Brio Retirement Living (Holdings) Limited,Company,"305 Gray's End Road, London, WC1X 8QR",London,WC1X 8QR,https://www.brioretirement.co.uk,94,Registered
PF000456,Brooke & Brown,Brooke & Brown,Sole Trader,"116  High Street, Dunbar, EH42 1JJ",Dunbar,EH42 1JJ,,0,Registration expired on 29/03/2016
PF000407,Bruce Macphail trading as guardian property F.S,Bruce Macphail trading as guardian property F.S,Sole Trader,"52, kempock st, Gourock, PA19 1ND",kempock st,PA19 1ND,,0,Registration expired on 11/06/2019
PF000974,Bryan Murray,IB Murray & Son,Sole Trader,"87 Perth Road, Dundee, DD1 4HZ",Perth,DD1 4HZ,,0,Registration expired on 07/08/2025
PF000119,Bute Factoring Services Ltd,Bute Factoring Services Ltd,Company,"53 Victoria Street, Rothesay, PA20 0AP",Rothesay,PA20 0AP,,0,Registration expired on 03/12/2018
PF000769,Bute Factors Ltd,Bute Factors Ltd,Company,"53 Victoria Street, Rothesay, PA20 0AP",Rothesay,PA20 0AP,,382,Registered
PF000956,C-urb 6 Ltd,Curb Factoring,Company,"Link House, 2c New Mart Road, Edinburgh, EH14 1RL",Link House,EH14 1RL,,7175,Registered
PF000259,Cadder Housing Association,Cadder Housing Association,Registered Social Landlord,"20 Fara Street, Cadder, Glasgow, G23 5AE",Cadder,G23 5AE,https://www.cadderha.co.uk,1102,Registered
PF000292,Cairn Housing Association Ltd,Cairn Housing Association Ltd,Registered Social Landlord,"Bellevue House, 22 Hopetoun Street, Edinburgh, EH7 4GH",Bellevue House,EH7 4GH,https://www.cairnha.com,2643,Registered
PF000417,Cairngorm Solutions Ltd,Cairngorm Solutions Ltd,Company,"15 Dalfaber Park, Aviemore, PH22 1QF",Aviemore,PH22 1QF,,0,Registration expired on 29/06/2022
PF000764,Calderwood Community Services Limited,Calderwood Community Services Limited,Company,"Unit 1A, Halbeath Interchange Business Park, Kingseat Road, Dunfermline, KY11 8RY",Kingseat Road,KY11 8RY,https://www.calderwoodcommunityservices.co.uk,976,Registered
PF000222,Caledonia Housing Association Limited,Caledonia Housing Association Limited,Registered Social Landlord,"Suite 4, Saltire House, 3 Whitefriars Crescent, Perth, PH2 0PA",Saltire House,PH2 0PA,https://www.caledoniaha.co.uk,1992,Registered
PF000331,Calvay Housing Association Ltd,Calvay Housing Association Ltd,Registered Social Landlord,"The Calvay Centre, 16 Calvay Road, Barlanark, Glasgow, G33 4RE",The Calvay Centre,G33 4RE,https://www.calvay.org.uk,122,Registered
PF000410,Cameron & Wright,Cameron & Wright,Partnership,"4 Crow Road, Glasgow, G11 7RT",Glasgow,G11 7RT,,0,Registration expired on 23/04/2019
PF000495,Capita Property & Infrastructure Limited,Capita Property & Infrastructure Limited,Company,"125 Shaftesbury Avenue, London, WC2H 8AD",London,WC2H 8AD,,0,Registration expired on 29/03/2017
PF000682,Carden (Buchan Braes) Ltd,Carden (Buchan Braes) Ltd,Company,"22 Rubislaw Terrace, Aberdeen, AB10 1XE",Aberdeen,AB10 1XE,,0,Registration expired on 08/10/2019
PF000138,Cassea Limited (EXPIRED),Cassea Limited (EXPIRED),Company,"Suite 1.7 Turnberry House, 175 West George Street, Glasgow, G2 2LB",Glasgow,G2 2LB,,0,Registration expired on 27/03/2018
PF000154,Cassiltoun Housing Association Limited,Cassiltoun Housing Association Limited,Registered Social Landlord,"59 Machrie Road, Glasgow, G45 0AZ",Glasgow,G45 0AZ,https://www.cassiltoun.org.uk,382,Registered
PF000161,Castlehill Housing Association Limited,Castlehill Housing Association,Registered Social Landlord,"4 Carden Place, Aberdeen, AB10 1UT",Aberdeen,AB10 1UT,https://www.castlehillha.co.uk,136,Registered
PF000230,Cathcart and District Housing Association Limited,Cathcart and District Housing Association Limited,Registered Social Landlord,"3 Rhannan Road, Cathcart, Glasgow, G44 3AZ",Cathcart,G44 3AZ,https://www.cathcartha.co.uk,920,Registered
PF001111,Catherine Hughes,CMH Property Management,Sole Trader,"The Old Bakehouse, 10 East Princes Street, Rothesay, PA20 9DL",The Old Bakehouse,PA20 9DL,,0,Registered
PF000185,Cd Environmental Design,Cd Environmental Design,Company,"Mile End Mill, Abbey Mills, PAISLEY, PA1 1JS",Mile End Mill,PA1 1JS,,0,Registration expired on 14/01/2016
PF000149,Cernach Housing Association Limited,Cernach Housing Association Limited,Registered Social Landlord,"Marion McDonald House, 79 Airgold Drive, Drumchapel, Glasgow, G15 7AJ",Marion McDonald House,G15 7AJ,https://www.cernachha.co.uk,141,Registered
PF000727,Chapelton Community Interest Company,Chapelton Community Interest Company,Company,"c/o Southesk Estate, Estate Office, Haughs of Kinnaird, Brechin, DD9 6UA",c/o Southesk Estate,DD9 6UA,,30,Registered
PF000225,Charing Cross Housing Association Ltd,Charing Cross Housing Association Ltd,Registered Social Landlord,"40 Barrowfield Drive, Glasgow, G40 3QH",Glasgow,G40 3QH,,0,Registration expired on 04/12/2024
PF000153,Charles White Limited,Charles White Limited,Company,"14 New Mart Road, Edinburgh, EH14 1RL",Edinburgh,EH14 1RL,https://www.charleswhite.co.uk,9487,Registered
PF001055,Chesnutt Skeoch Ltd,Chesnutt Skeoch Ltd,Company,"30 East Main Street, Darvel, KA17 0HP",Darvel,KA17 0HP,,27,Registered
PF000927,Christopher Moore,Factor Moore,Sole Trader,"Nevay View Cottage, West Nevay Farm, Newtyle, BLAIRGOWRIE, PH12 8SJ",Nevay View Cottage,PH12 8SJ,,6,Registered
PF000504,City Factoring Limited,City Factoring Limited,Company,"Unit 1, Aitrium Business Centre, Coatbridge, ML5 4EF",Aitrium Business Centre,ML5 4EF,,0,Registration expired on 12/12/2016
PF000773,CKD Galbraith LLP,CKD Galbraith LLP,Partnership,"59 George Street, Edinburgh, EH2 2JG",Edinburgh,EH2 2JG,,0,Registration expired on 14/01/2025
PF000604,Clackan Ltd,Clackan Ltd,Company,"9 Ashgrove, Scone, Perth, PH2 6NU",Scone,PH2 6NU,,0,Registration expired on 04/09/2018
PF000327,Clackmannanshire Council,Clackmannanshire Council,Local Authority,"Kilncraigs, Greenside Street, Alloa, FK10 1EB",Kilncraigs,FK10 1EB,,0,Registration expired on 29/11/2022
PF000455,Clackmannanshire Services Ltd,Clackmannanshire Services Ltd,Company,"49 Laird's Drive, Trading as: Bavaria Construction &, Property Management, Clackmannan, FK10 4EQ",Property Management,FK10 4EQ,,0,Registration expired on 29/03/2016
PF000317,Clan Gordon Ltd,Clan Gordon Ltd,Company,"Unit 1b, 1 Carmichael Place, Edinburgh, EH6 5PH",Edinburgh,EH6 5PH,,0,Registration expired on 19/03/2019
PF001151,Clan Property Management Ltd,Clan Property Management Ltd,Company,"Unit 106 Embroidery Mill, Abbey Mill Business Centre, Paisley, PA1 1TJ",Abbey Mill Business Centre,PA1 1TJ,https://www.clanpm.co.uk,0,Registered
PF000629,Clark Family Investments Ltd,Clark Family Investments Ltd,Company,"10B Wellmeadow Street, Paisley, PA1 2EE",Paisley,PA1 2EE,,0,Registration expired on 04/04/2022
PF000966,Cleodius Limited,Cleodius Limited,Company,"71-75 Shelton Street, London, WC2H 9JQ",London,WC2H 9JQ,,0,Registered
PF000132,Click-let Ltd,Click-let Ltd,Company,"30 Queensferry Road, Level 2, Edinburgh, EH4 2HS",Edinburgh,EH4 2HS,,0,Registration expired on 14/01/2019
